3923309010,3923.30.90.10,3923.30.90.10 (2017-01/9999-12),201701,999912,,N/A (2017-01/9999-12),201701,999912,"Bottles, of polyethylene (polymers of ethylene)","Bouteilles, de polyéthylène (polymères d'éthylène)"
3923309011,3923.30.90.11,3923.30.90.11 (1998-01/2016-12),199801,201612,,N/A (1998-01/2016-12),199801,201612,"Bottles, of polymers of ethylene, capacity <=2 litres","Bouteilles, en polymères de l'éthylène, contenance <=2 L"
3923309012,3923.30.90.12,3923.30.90.12 (1998-01/2016-12),199801,201612,,N/A (1998-01/2016-12),199801,201612,"Bottles, of polymers of ethylene, capacity >2 litres","Bouteilles, en polymères de l'éthylène, contenance > 2 L"
3923309020,3923.30.90.20,3923.30.90.20 (2012-01/2016-12),201201,201612,,N/A (2012-01/2016-12),201201,201612,"Bottles, of polymers of vinyl chloride","Bouteilles, en polymères de chlorure de vinyle"
3923309021,3923.30.90.21,3923.30.90.21 (1998-01/2011-12),199801,201112,,N/A (1998-01/2011-12),199801,201112,"Bottles, of polymers of vinyl chloride, capacity <=2 litres","Bouteilles, en polymères de chlorure de vinyle, cont <=2 L"
3923309022,3923.30.90.22,3923.30.90.22 (1998-01/2011-12),199801,201112,,N/A (1998-01/2011-12),199801,201112,"Bottles, of polymers of vinyl chloride, capacity >2 litres","Bouteilles, en polymères de chlorure de vinyle, cont > 2 L"
3923309031,3923.30.90.31,3923.30.90.31 (1998-01/9999-12),199801,999912,,N/A (1998-01/9999-12),199801,999912,"Bottles, of polyethylene terephthalate, capacity <= 2 litres","Bouteilles, en polyéthylène téréphtalate, contenance <=2 l"
3923309032,3923.30.90.32,3923.30.90.32 (1998-01/9999-12),199801,999912,,N/A (1998-01/9999-12),199801,999912,"Bottles, of polyethylene terephthalate, capacity > 2litres","Bouteilles, en polyéthylène téréphtalate, contenance > 2 l"
3923309040,3923.30.90.40,3923.30.90.40 (2012-01/2016-12),201201,201612,,N/A (2012-01/2016-12),201201,201612,"Bottles, of polycarbonates","Bouteilles, en polycarbonates"
3923309041,3923.30.90.41,3923.30.90.41 (1998-01/2011-12),199801,201112,,N/A (1998-01/2011-12),199801,201112,"Bottles, of polycarbonates, capacity <=2 litres","Bouteilles, en polycarbonates, contenance <=2 L"
3923309042,3923.30.90.42,3923.30.90.42 (1998-01/2011-12),199801,201112,,N/A (1998-01/2011-12),199801,201112,"Bottles, of polycarbonates, capacity > 2 litres","Bouteilles, en polycarbonates, contenance > 2 L"
3923309081,3923.30.90.81,3923.30.90.81 (1998-01/9999-12),199801,999912,,N/A (1998-01/9999-12),199801,999912,"Bottles, of plastics, nes, capacity <=2 litres","Bouteilles, en matières plastiques, nda, contenance <=2 l"
3923309082,3923.30.90.82,3923.30.90.82 (1998-01/9999-12),199801,999912,,N/A (1998-01/9999-12),199801,999912,"Bottles, of plastics, nes, capacity > 2 litres","Bouteilles, en matières plastiques, nda, contenance > 2 l"
3923309090,3923.30.90.90,3923.30.90.90 (1998-01/2016-12),199801,201612,,N/A (1998-01/2016-12),199801,201612,"Carboys, flasks & similar articles, of plastics, nes","Bonbonnes, flacons et articles similaires, en matières plastiques, nda"
3923309090,3923.30.90.90,3923.30.90.90 (2017-01/9999-12),201701,999912,,N/A (2017-01/9999-12),201701,999912,"Carboys, flasks and similar articles, of plastics, nes","Bonbonnes, flacons et articles similaires, en matières plastiques, nda"
3923400000,3923.40.00.00,3923.40.00.00 (2014-10/9999-12),201410,999912,,N/A (2014-10/9999-12),201410,999912,"Spools, cops, bobbins and similar supports, of plastics","Bobines, fusettes, canettes et supports similaires, en matières plastiques"
3923400010,3923.40.00.10,3923.40.00.10 (1988-01/1995-06),198801,199506,NMB,NMB (1988-01/1995-06),198801,199506,"Bobbins for textile machines, of plastics","Bobines pour machines textiles, en matières plastiques"
3923400090,3923.40.00.90,3923.40.00.90 (1988-01/1995-06),198801,199506,,N/A (1988-01/1995-06),198801,199506,"Spools, cops, bobbins & similar supports, of plastics, nes","Bobines, busettes, canettes et articles similaires, en matières plastiques, nda"
3923401000,3923.40.10.00,3923.40.10.00 (1995-07/1997-12),199507,199712,,N/A (1995-07/1997-12),199507,199712,"Cones or supports of plastics,of a lenght of 165 mm or more f wind tex yarn","C.nes ou supports en mati plastique lo >=165 mm, type util pr bobiner fils te"
3923401000,3923.40.10.00,3923.40.10.00 (1998-01/2014-09),199801,201409,,N/A (1998-01/2014-09),199801,201409,"Cone,le>=165mm,empl winding tex yarn/spool,cop,bobbin mfr video cassette,plastic","Cône,long>=165mm,util pr bobiner fils tex/bobine,etc,fab cassette vidéo,plast"
3923409000,3923.40.90.00,3923.40.90.00 (2012-01/2014-09),201201,201409,,N/A (2012-01/2014-09),201201,201409,"Spools, cops, bobbins & similar supports, of plastics, nes","Bobines, fusettes, canettes et articles similaires, en matières plastiques, nda"
3923409010,3923.40.90.10,3923.40.90.10 (1995-07/2011-12),199507,201112,NMB,NMB (1995-07/2011-12),199507,201112,"Bobbins for textile machines, of plastics","Bobines pour machines textiles, en matières plastiques"
3923409090,3923.40.90.90,3923.40.90.90 (1995-07/1997-12),199507,199712,,N/A (1995-07/1997-12),199507,199712,"Spools, cops, bobbins & similar supports, of plastics, nes","Bobines, busettes, canettes et articles similaires, en matières plastiques, nda"
3923409090,3923.40.90.90,3923.40.90.90 (1998-01/2011-12),199801,201112,,N/A (1998-01/2011-12),199801,201112,"Spools, cops, bobbins & similar supports, of plastics, nes","Bobines, fusettes, canettes et articles similaires, en matières plastiques, nda"
3923501000,3923.50.10.00,3923.50.10.00 (1988-01/1997-12),198801,199712,,N/A (1988-01/1997-12),198801,199712,"Bottle caps, of plastics","Capsules pour bouteilles, en matières plastiques"
3923501000,3923.50.10.00,3923.50.10.00 (1998-01/2002-03),199801,200203,,N/A (1998-01/2002-03),199801,200203,"Caps,empl perfume mfr/stopper,lid,caps & o closures,for vaccine,toxoid,etc,plast","Capsules util pr embouteillage parfum/bouchon,couvercle,etc,pr vaccin,etc,plast"
3923501000,3923.50.10.00,3923.50.10.00 (2002-04/9999-12),200204,999912,,N/A (2002-04/9999-12),200204,999912,"Caps,empl by perfume mfr,flex spout,stopr,lid,cap,etc,f vaccine,toxoid,etc,plast","Caps util pr embouteil parfum,bec souple,bouchon,couver,etc,pr vaccin,etc,plast"
3923509010,3923.50.90.10,3923.50.90.10 (1988-01/9999-12),198801,999912,,N/A (1988-01/9999-12),198801,999912,"Lids for cups, of plastics","Couvercles pour gobelets, en matières plastiques"
3923509020,3923.50.90.20,3923.50.90.20 (1988-01/2011-12),198801,201112,,N/A (1988-01/2011-12),198801,201112,"Brush-on closures, of plastics","Bouchons applicateurs, en matières plastiques"
3923509030,3923.50.90.30,3923.50.90.30 (1988-01/2011-12),198801,201112,,N/A (1988-01/2011-12),198801,201112,"Shaker-type tops for cans, of plastics","Couvercles perforés pour boîtes, type à saupoudrer, en matières plastiques"
3923509040,3923.50.90.40,3923.50.90.40 (1998-01/9999-12),199801,999912,,N/A (1998-01/9999-12),199801,999912,"Bottle caps, of plastics","Capsules pour bouteilles, en matières plastiques"
3923509090,3923.50.90.90,3923.50.90.90 (1988-01/1997-12),198801,199712,,N/A (1988-01/1997-12),198801,199712,"Stoppers, lids, caps & other closures, nes, of plastics","Bouchons, couvercles, capsules, au dispositifs de fermeture, nda, en mati plast"
3923509090,3923.50.90.90,3923.50.90.90 (1998-01/2002-03),199801,200203,,N/A (1998-01/2002-03),199801,200203,"Stoppers, lids, caps & other closures, nes, of plastics","Bouchons, couvercles, capsules, au dispositifs de fermeture, nda, en mati plast"
3923509090,3923.50.90.90,3923.50.90.90 (2002-04/2011-12),200204,201112,,N/A (2002-04/2011-12),200204,201112,"Stoppers, lids, caps & other closures, nes, of plastics","Bouchons, couvercles, capsules, au dispositifs de fermeture, nda, en mati plast"
3923509090,3923.50.90.90,3923.50.90.90 (2012-01/9999-12),201201,999912,,N/A (2012-01/9999-12),201201,999912,"Stoppers, lids, caps and other closures, of plastics, nes","Bouchons, couvercles, capsules, au dispositifs de fermeture, en mati plast, nda"
3923900010,3923.90.00.10,3923.90.00.10 (1988-01/1992-04),198801,199204,,N/A (1988-01/1992-04),198801,199204,"Blister paks, of plastics","Emballages cloches, en matières plastiques"
3923900020,3923.90.00.20,3923.90.00.20 (1988-01/1992-04),198801,199204,,N/A (1988-01/1992-04),198801,199204,"Vials, of plastics","Fioles, en matières plastiques"
3923900031,3923.90.00.31,3923.90.00.31 (1988-01/1992-04),198801,199204,,N/A (1988-01/1992-04),198801,199204,"Drums, capacity <=25 litres, of plastics","Tonneaux, contenance <=25 L, en matières plastiques"
3923900032,3923.90.00.32,3923.90.00.32 (1988-01/1992-04),198801,199204,,N/A (1988-01/1992-04),198801,199204,"Drums, capacity > 25 litres but <=120 litres, of plastics","Tonneaux, contenance > 25 L mais <=120 L, en matières plastiques"
3923900033,3923.90.00.33,3923.90.00.33 (1988-01/1992-04),198801,199204,,N/A (1988-01/1992-04),198801,199204,"Drums, capacity > 120 litres, of plastics","Tonneaux, contenance > 120 L, en matières plastiques"
3923900040,3923.90.00.40,3923.90.00.40 (1988-01/1992-04),198801,199204,,N/A (1988-01/1992-04),198801,199204,"Plant containers, of plastics","Bacs pour les plantes, en matières plastiques"
3923900050,3923.90.00.50,3923.90.00.50 (1988-01/1991-06),198801,199106,,N/A (1988-01/1991-06),198801,199106,"Trays for produce or meat display, of plastics","Plateaux pour les étalages de légumes ou de viandes, en matières plastiques"
3923900050,3923.90.00.50,3923.90.00.50 (1991-07/1992-04),199107,199204,,N/A (1991-07/1992-04),199107,199204,"Single portion containers, e.g. for jams,for butter/milk for coffee, of plastics","Contenants à portion unique,p. ex. à confiture, beurre, crème, en mati plast"
3923900060,3923.90.00.60,3923.90.00.60 (1988-01/1991-06),198801,199106,,N/A (1988-01/1991-06),198801,199106,"Single portion containers,e.g. for jams,for butter/milk for coffee), of plastics","Contenants à portion unique,p. ex. à confiture, beurre, crème, en mati plast"
3923900060,3923.90.00.60,3923.90.00.60 (1991-07/1992-04),199107,199204,,N/A (1991-07/1992-04),199107,199204,"Juice or other beverage containers, of a capacity not exceeding 250ml,of plastic","Contenants pour les jus ou autres boissons, contenance <=250 ml, en mati plast"
3923900070,3923.90.00.70,3923.90.00.70 (1988-01/1991-06),198801,199106,,N/A (1988-01/1991-06),198801,199106,"Juice or other beverage containers, of a capacity not exceeding 250ml,of plastic","Contenants pour les jus ou autres boissons, contenance <=250 ml, en mati plast"
3923900070,3923.90.00.70,3923.90.00.70 (1991-07/1992-04),199107,199204,,N/A (1991-07/1992-04),199107,199204,"Juice or other beverage containers, of a capacity not exceeding 250ml,of plastic","Contenants pour les jus ou autres boissons, contenance <=250 ml, en mati plast"
3923900080,3923.90.00.80,3923.90.00.80 (1988-01/1991-06),198801,199106,,N/A (1988-01/1991-06),198801,199106,"Juice or other beverage containers, of a capacity not exceeding 250ml,of plastic","Contenants pour les jus ou autres boissons, contenance <=250 ml, en mati plast"
3923900090,3923.90.00.90,3923.90.00.90 (1988-01/1991-06),198801,199106,,N/A (1988-01/1991-06),198801,199106,"Articles for the conveyance or packing of goods nes, of plastics","Articles pour le transport ou l'emballage des marchandises nda, en mati plast"
3923900090,3923.90.00.90,3923.90.00.90 (1991-07/1992-04),199107,199204,,N/A (1991-07/1992-04),199107,199204,"Articles for the conveyance or packing of goods nes, of plastics","Articles pour le transport ou l'emballage des marchandises nda, en mati plast"
3923901000,3923.90.10.00,3923.90.10.00 (1992-05/1997-12),199205,199712,,N/A (1992-05/1997-12),199205,199712,"Holding trays, PVC, for use as inserts in peaches packaging boxes","Plateaux de fixation,PVC,utilisés comme séparateurs,dans l'emballage des pêches"
3923901000,3923.90.10.00,3923.90.10.00 (2011-12/9999-12),201112,999912,,N/A (2011-12/9999-12),201112,999912,"Plastic cnt w cartoon,f bath prod;art f vaccines,etc;veg-based cap f CDN mfr,etc","Cont mati plast,a ba dessi,pr prod bain;art pr vaccins,etc;caps pr fab prod CDN"
3923901010,3923.90.10.10,3923.90.10.10 (1998-01/2011-11),199801,201111,,N/A (1998-01/2011-11),199801,201111,"Holding trays, PVC, for use as inserts in peaches packaging boxes","Plateaux de fixation,PVC,utilisés comme séparateurs,dans l'emballage des pêches"
3923901090,3923.90.10.90,3923.90.10.90 (1998-01/1998-07),199801,199807,,N/A (1998-01/1998-07),199801,199807,"Art for conveyance/packing of goods,of plastics,for vaccin,toxoid,etc","Art de transport/emballage,en mati plastique,pr vaccin,toxoïde,etc"
3923901090,3923.90.10.90,3923.90.10.90 (1998-08/2011-11),199808,201111,,N/A (1998-08/2011-11),199808,201111,"Cntr,cartoon f bath prod; art f convey/pack plastic goods,f vaccin,toxoid,etc","Cont,ba dessinée,pr prod bain;art de trans/emb,mati plast,pr vaccin,toxoïde,etc"
3923909010,3923.90.90.10,3923.90.90.10 (1992-05/2016-12),199205,201612,,N/A (1992-05/2016-12),199205,201612,"Blister paks, of plastics","Emballages cloches, en matières plastiques"
3923909020,3923.90.90.20,3923.90.90.20 (1992-05/1997-12),199205,199712,,N/A (1992-05/1997-12),199205,199712,"Vials, of plastics","Fioles, en matières plastiques"
3923909020,3923.90.90.20,3923.90.90.20 (1998-01/9999-12),199801,999912,,N/A (1998-01/9999-12),199801,999912,"Vials, of plastics, nes","Fioles, en matières plastiques, nda"
3923909030,3923.90.90.30,3923.90.90.30 (2012-01/9999-12),201201,999912,,N/A (2012-01/9999-12),201201,999912,"Drums, of plastics, nes","Tonneaux, en matières plastiques, nda"
3923909031,3923.90.90.31,3923.90.90.31 (1992-05/1997-12),199205,199712,,N/A (1992-05/1997-12),199205,199712,"Drums, capacity <=25 litres, of plastics","Tonneaux, contenance <=25 L, en matières plastiques"
3923909031,3923.90.90.31,3923.90.90.31 (1998-01/2011-12),199801,201112,,N/A (1998-01/2011-12),199801,201112,"Drums, capacity <=25 litres, of plastics, nes","Tonneaux, contenance <=25 L, en matières plastiques, nda"
3923909032,3923.90.90.32,3923.90.90.32 (1992-05/1997-12),199205,199712,,N/A (1992-05/1997-12),199205,199712,"Drums, capacity > 25 litres but <=120 litres, of plastics","Tonneaux, contenance > 25 L mais <=120 L, en matières plastiques"
3923909032,3923.90.90.32,3923.90.90.32 (1998-01/2011-12),199801,201112,,N/A (1998-01/2011-12),199801,201112,"Drums, capacity > 25 litres but <=120 litres, of plastics, nes","Tonneaux, contenance > 25 L mais <=120 L, en matières plastiques, nda"
3923909033,3923.90.90.33,3923.90.90.33 (1992-05/1997-12),199205,199712,,N/A (1992-05/1997-12),199205,199712,"Drums, capacity > 120 litres, of plastics","Tonneaux, contenance > 120 L, en matières plastiques"
3923909033,3923.90.90.33,3923.90.90.33 (1998-01/2011-12),199801,201112,,N/A (1998-01/2011-12),199801,201112,"Drums, capacity > 120 litres, of plastics, nes","Tonneaux, contenance > 120 L, en matières plastiques, nda"
3923909040,3923.90.90.40,3923.90.90.40 (1992-05/9999-12),199205,999912,,N/A (1992-05/9999-12),199205,999912,"Plant containers, of plastics","Bacs pour les plantes, en matières plastiques"
3923909050,3923.90.90.50,3923.90.90.50 (1992-05/9999-12),199205,999912,,N/A (1992-05/9999-12),199205,999912,"Trays for produce or meat display, of plastics","Plateaux pour les étalages de légumes ou de viandes, en matières plastiques"
3923909060,3923.90.90.60,3923.90.90.60 (1992-05/9999-12),199205,999912,,N/A (1992-05/9999-12),199205,999912,"Single portion containers, e.g. for jams,for butter/milk for coffee, of plastics","Contenants à portion unique,p.ex. à confiture, beurre, crème, en mati plast"
3923909070,3923.90.90.70,3923.90.90.70 (1992-05/2011-11),199205,201111,,N/A (1992-05/2011-11),199205,201111,"Juice or other beverage containers,of a capacity not exceeding 250 ml,of plastic","Contenants pour les jus ou autres boissons, contenance <=250 ml, en mati plast"
3923909080,3923.90.90.80,3923.90.90.80 (1998-01/9999-12),199801,999912,,N/A (1998-01/9999-12),199801,999912,Ice cream tubs and similar containers of plastics,"Contenants pour crème glacée et contenants similaires, en matières plastiques"
3923909090,3923.90.90.90,3923.90.90.90 (1992-05/1997-12),199205,199712,,N/A (1992-05/1997-12),199205,199712,"Articles for the conveyance or packing of goods nes, of plastics","Articles pour le transport ou l'emballage des marchandises nda, en mati plast"
3923909090,3923.90.90.90,3923.90.90.90 (1998-01/1998-07),199801,199807,,N/A (1998-01/1998-07),199801,199807,"Articles for the conveyance or packing of goods nes, of plastics","Articles pour le transport ou l'emballage des marchandises nda, en mati plast"
3923909090,3923.90.90.90,3923.90.90.90 (1998-08/2011-11),199808,201111,,N/A (1998-08/2011-11),199808,201111,"Articles for the conveyance or packing of goods nes, of plastics","Articles pour le transport ou l'emballage des marchandises nda, en mati plast"
3923909090,3923.90.90.90,3923.90.90.90 (2011-12/2016-12),201112,201612,,N/A (2011-12/2016-12),201112,201612,"Plastic articles, for the conveyance or packing of goods, nes","Articles en matières plastiques,pour le transport/emballage des marchandises,nda"
3923909090,3923.90.90.90,3923.90.90.90 (2017-01/9999-12),201701,999912,,N/A (2017-01/9999-12),201701,999912,"Articles for the conveyance or packing of goods, of plastics, nes","Articles de transport ou d'emballage, en matières plastiques, nda"
3924100011,3924.10.00.11,3924.10.00.11 (1998-01/9999-12),199801,999912,,N/A (1998-01/9999-12),199801,999912,"Trays, tableware, of plastics","Plateaux, articles de table, en matières plastiques"
3924100012,3924.10.00.12,3924.10.00.12 (1998-01/2011-12),199801,201112,,N/A (1998-01/2011-12),199801,201112,"Place mats & other table mats, of plastics","Napperons et sets de table, en matières plastiques"
3924100019,3924.10.00.19,3924.10.00.19 (1998-01/2011-12),199801,201112,,N/A (1998-01/2011-12),199801,201112,"Tableware not including tumblers or disposable goods, of plastics, nes","Articles de table, a/q verres et articles jetables, en matières plastiques, nda"
3924100019,3924.10.00.19,3924.10.00.19 (2012-01/9999-12),201201,999912,,N/A (2012-01/9999-12),201201,999912,"Tableware,of plastics,not incl tumblers/disposable goods, other than trays, nes","Articles de table,en mati plas,a/q verres et articles jetables,a/q plateaux, nda"
3924100091,3924.10.00.91,3924.10.00.91 (1998-01/9999-12),199801,999912,,N/A (1998-01/9999-12),199801,999912,"Utensils, kitchenware, of plastics","Ustensiles de cuisine, en matières plastiques"
3924100092,3924.10.00.92,3924.10.00.92 (1998-01/9999-12),199801,999912,,N/A (1998-01/9999-12),199801,999912,"Food storage containers, kitchenware, of plastics","Récipients pour conserver les aliments, articles de cuisine, en mati plast"
3924100093,3924.10.00.93,3924.10.00.93 (1998-01/9999-12),199801,999912,,N/A (1998-01/9999-12),199801,999912,"Disposable tumblers & cups, of plastics","Gobelets et tasses jetables, en matières plastiques"
3924100094,3924.10.00.94,3924.10.00.94 (1998-01/9999-12),199801,999912,,N/A (1998-01/9999-12),199801,999912,"Other disposable tableware, of plastics","Autres articles de table jetables, en matières plastiques"
3924100095,3924.10.00.95,3924.10.00.95 (1998-01/2011-12),199801,201112,,N/A (1998-01/2011-12),199801,201112,"Kitchen utensil organizers, tray or carousel, of plastics","Ramasse-couverts, plateaux ou carrousels, en matières plastiques"
3924100096,3924.10.00.96,3924.10.00.96 (1998-01/9999-12),199801,999912,,N/A (1998-01/9999-12),199801,999912,"Cookware, of plastics","Articles pour la cuisson, en matières plastiques"
3924100097,3924.10.00.97,3924.10.00.97 (1998-01/9999-12),199801,999912,,N/A (1998-01/9999-12),199801,999912,"Other tumblers, of plastics","Autres gobelets, en matières plastiques"
3924100099,3924.10.00.99,3924.10.00.99 (1998-01/2011-12),199801,201112,,N/A (1998-01/2011-12),199801,201112,"Kitchenware, of plastics, nes","Articles de cuisine, en matières plastiques, nda"
3924100099,3924.10.00.99,3924.10.00.99 (2012-01/9999-12),201201,999912,,N/A (2012-01/9999-12),201201,999912,"Kitchenware, of plastics, nes","Articles de cuisine, en matières plastiques, nda"
3924101000,3924.10.10.00,3924.10.10.00 (1988-01/1989-12),198801,198912,,N/A (1988-01/1989-12),198801,198912,"Tableware not including tumblers or disposable goods, of plastics","Articles de table, a/q verres et articles jetables, en matières plastiques"
3924101010,3924.10.10.10,3924.10.10.10 (1990-01/1997-12),199001,199712,,N/A (1990-01/1997-12),199001,199712,"Trays - tableware, of plastics","Plateaux, articles de table, en matières plastiques"
3924101020,3924.10.10.20,3924.10.10.20 (1992-07/1997-12),199207,199712,KGM,KGM (1992-07/1992-12),199207,199212,"Place mats & other table mats, of plastics","Napperons et sets de table, en matières plastiques"
3924101020,3924.10.10.20,3924.10.10.20 (1992-07/1997-12),199207,199712,,N/A (1993-01/1997-12),199301,199712,"Place mats & other table mats, of plastics","Napperons et sets de table, en matières plastiques"
3924101090,3924.10.10.90,3924.10.10.90 (1990-01/1997-12),199001,199712,,N/A (1990-01/1997-12),199001,199712,"Tableware not including tumblers or disposable goods, of plastics, nes","Articles de table, a/q verres et articles jetables, en matières plastiques, nda"
3924109010,3924.10.90.10,3924.10.90.10 (1988-01/1997-12),198801,199712,,N/A (1988-01/1997-12),198801,199712,"Utensils - kitchenware, of plastics","Ustensiles de cuisine, en matières plastiques"
3924109020,3924.10.90.20,3924.10.90.20 (1988-01/1997-12),198801,199712,,N/A (1988-01/1997-12),198801,199712,"Food storage containers - kitchenware, of plastics","Récipients pour conserver les aliments, articles de cuisine, en mati plast"
3924109030,3924.10.90.30,3924.10.90.30 (1988-01/1997-12),198801,199712,,N/A (1988-01/1997-12),198801,199712,"Disposable tumblers & cups, of plastics","Gobelets et tasses jetables, en matières plastiques"
3924109040,3924.10.90.40,3924.10.90.40 (1988-01/1997-12),198801,199712,,N/A (1988-01/1997-12),198801,199712,"Other disposable tableware, of plastics","Autres articles de table jetables, en matières plastiques"
3924109050,3924.10.90.50,3924.10.90.50 (1988-01/1997-12),198801,199712,,N/A (1988-01/1997-12),198801,199712,"Kitchen utensil organizers, tray or carousel, of plastics","Ramasse-couverts, plateaux ou carrousels, en matières plastiques"
3924109060,3924.10.90.60,3924.10.90.60 (1988-01/1997-12),198801,199712,,N/A (1988-01/1997-12),198801,199712,"Cookware, of plastics","Articles pour la cuisson, en matières plastiques"
3924109070,3924.10.90.70,3924.10.90.70 (1988-01/1997-12),198801,199712,,N/A (1988-01/1997-12),198801,199712,"Other tumblers, of plastics","Autres gobelets, en matières plastiques"
3924109090,3924.10.90.90,3924.10.90.90 (1988-01/1997-12),198801,199712,,N/A (1988-01/1997-12),198801,199712,"Kitchenware, of plastics, nes","Articles de cuisine, en matières plastiques, nda"
3924900010,3924.90.00.10,3924.90.00.10 (1995-07/9999-12),199507,999912,,N/A (1995-07/9999-12),199507,999912,"Bathroom accessories, of plastics","Accessoires de salle de bain, en matières plastiques"
3924900020,3924.90.00.20,3924.90.00.20 (1995-07/9999-12),199507,999912,NMB,NMB (1995-07/9999-12),199507,999912,"Portable picnic coolers, of plastics","Glacières portatives de pique-nique, en matières plastiques"
3924900030,3924.90.00.30,3924.90.00.30 (1995-07/2011-12),199507,201112,,N/A (1995-07/2011-12),199507,201112,"Ashtrays, of plastics","Cendriers, en matières plastiques"
3924900040,3924.90.00.40,3924.90.00.40 (1995-07/9999-12),199507,999912,,N/A (1995-07/9999-12),199507,999912,"Flower pots, of plastics","Pots à fleurs, en matières plastiques"
3924900051,3924.90.00.51,3924.90.00.51 (1995-07/9999-12),199507,999912,,N/A (1995-07/9999-12),199507,999912,"Shower curtains, of plastics","Rideaux de douche, en matières plastiques"
3924900059,3924.90.00.59,3924.90.00.59 (1995-07/9999-12),199507,999912,,N/A (1995-07/9999-12),199507,999912,"Curtains, nes, of plastics","Rideaux, nda, en matières plastiques"
3924900060,3924.90.00.60,3924.90.00.60 (2017-01/9999-12),201701,999912,,N/A (2017-01/9999-12),201701,999912,"Tablecloths, of plastics","Nappes, en matières plastiques"
3924900061,3924.90.00.61,3924.90.00.61 (1995-07/2016-12),199507,201612,,N/A (1995-07/2016-12),199507,201612,"Tablecloths, of plastics","Nappes, en matières plastiques"
3924900062,3924.90.00.62,3924.90.00.62 (1995-07/2011-12),199507,201112,,N/A (1995-07/2011-12),199507,201112,"Dresser covers, of plastics","Dessus de buffet, en matières plastiques"
3924900063,3924.90.00.63,3924.90.00.63 (1995-07/2011-12),199507,201112,,N/A (1995-07/2011-12),199507,201112,"Mattress covers, of plastics","Protège-matelas, en matières platiques"
3924900064,3924.90.00.64,3924.90.00.64 (1995-07/2011-12),199507,201112,,N/A (1995-07/2011-12),199507,201112,"Pillow covers, of plastics","Taies d'oreiller, en matières plastiques"
3924900069,3924.90.00.69,3924.90.00.69 (2012-01/2016-12),201201,201612,,N/A (2012-01/2016-12),201201,201612,"Dresser covers, mattress covers, pillow covers, of plastics","Dessus de buffet, couvre-matelas, couvre-oreillers, en matières plastiques"
3924900070,3924.90.00.70,3924.90.00.70 (2017-01/9999-12),201701,999912,,N/A (2017-01/9999-12),201701,999912,"Clothes hangers, of plastics","Cintres pour vêtements, en matières plastiques"
3924900071,3924.90.00.71,3924.90.00.71 (1995-07/2011-12),199507,201112,,N/A (1995-07/2011-12),199507,201112,"Garment bags, of plastics","Housses à vêtements, en matières plastiques"
3924900072,3924.90.00.72,3924.90.00.72 (1995-07/2016-12),199507,201612,,N/A (1995-07/2016-12),199507,201612,"Garment hangers, of plastics","Cintres pour vêtements, en matières plastiques"
3924900079,3924.90.00.79,3924.90.00.79 (1995-07/2011-12),199507,201112,,N/A (1995-07/2011-12),199507,201112,"Wardrobe accessories, nes, of plastics","Accessoires de penderies, nda, en matières plastiques"
