8907100000,8907.10.00.00,8907.10.00.00 (1988-01/1997-12),198801,199712,NMB,NMB (1988-01/1997-12),198801,199712,"Inflatable rafts, including those for carrying shipwrecked persons","Radeaux gonflables,y compris les engins flottants servant au trans des nauf"
8907101000,8907.10.10.00,8907.10.10.00 (1998-01/9999-12),199801,999912,NMB,NMB (1998-01/9999-12),199801,999912,Inflatable rafts imported by societies dedicated to the saving of life,Radeaux gonflables importés par des sociétés spécil dans le sauvetages de vies
8907109000,8907.10.90.00,8907.10.90.00 (1998-01/9999-12),199801,999912,NMB,NMB (1998-01/9999-12),199801,999912,"Other floating structures, nes, other than inflatable rafts for life saving","Autres engins flottants, nda, a/q radeaux gonflables pour le sauvetage des vies"
8907901000,8907.90.10.00,8907.90.10.00 (1988-01/1997-12),198801,199712,NMB,NMB (1988-01/1997-12),198801,199712,Buoys and beacons,Bouées et balises
8907901000,8907.90.10.00,8907.90.10.00 (1998-01/9999-12),199801,999912,NMB,NMB (1998-01/9999-12),199801,999912,"Buoys, marker, o/t wood, used for com fishing/com harvesting of marine plants","Bouées et balises, de bois pour pêche comm ou récolte comm de plantes aquatiques"
8907902000,8907.90.20.00,8907.90.20.00 (1998-01/9999-12),199801,999912,NMB,NMB (1998-01/9999-12),199801,999912,"Buoys and beacons, nes, o/t com fishing/com marine plant harvesting, o/t wood","Bouées et balises, nda, a/q pr pêche comm ou récolte comm de plantes aquatiques"
8907909000,8907.90.90.00,8907.90.90.00 (1988-01/9999-12),198801,999912,NMB,NMB (1988-01/9999-12),198801,999912,"Structures, floating, nes","Engins flottants, nda"
8908000000,8908.00.00.00,8908.00.00.00 (1988-01/1989-04),198801,198904,NMB,NMB (1988-01/1989-04),198801,198904,"Vessels & other floating structures, for breaking up (scrapping) nes","Bateaux et autres engins flottants à dépecer, pour la casse, nda"
8908001000,8908.00.10.00,8908.00.10.00 (1989-05/9999-12),198905,999912,TNE,TNE (1989-05/9999-12),198905,999912,"Vessels and other fltg struc, to be scrapped, stripped of salvageable art/equip","Bateaux et autres engins flottants à dépecer, dépouillés du matériel récupérable"
8908009000,8908.00.90.00,8908.00.90.00 (1989-05/9999-12),198905,999912,TNE,TNE (1989-05/9999-12),198905,999912,"Vessels and other floating structures, for breaking up, scrapping nes","Bateaux et autres engins flottants à dépecer, pour la casse, nda"
