9504909099,9504.90.90.99,9504.90.90.99 (1988-01/2001-12),198801,200112,,N/A (1988-01/2001-12),198801,200112,"Articles of funfair & parlour games, nes","Articles pour jeux de société, nda"
9504909099,9504.90.90.99,9504.90.90.99 (2002-01/2011-12),200201,201112,,N/A (2002-01/2011-12),200201,201112,"Articles of funfair & parlour games, nes","Articles pour jeux de société, nda"
9505100010,9505.10.00.10,9505.10.00.10 (1988-01/9999-12),198801,999912,,N/A (1988-01/9999-12),198801,999912,"Christmas trees, artificial",Arbres de Noël artificiels
9505100090,9505.10.00.90,9505.10.00.90 (1988-01/9999-12),198801,999912,,N/A (1988-01/9999-12),198801,999912,"Articles for Christmas festivities, o/t artificial Christmas trees","Articles pour les fêtes de Noël, a/q arbres de Noël artificiels"
9505900010,9505.90.00.10,9505.90.00.10 (1998-01/9999-12),199801,999912,,N/A (1998-01/9999-12),199801,999912,"Hats and masks, novelty",Chapeaux et masques de déguisement
9505900090,9505.90.00.90,9505.90.00.90 (1998-01/9999-12),199801,999912,,N/A (1998-01/9999-12),199801,999912,"Festive, carnival or other entertainment articles incl tricks and jokes, nes","Articles de fêtes,carnaval ou au divertissements,incl de magie et surprises,nda"
9505901000,9505.90.10.00,9505.90.10.00 (1988-01/1997-12),198801,199712,,N/A (1988-01/1997-12),198801,199712,"Hats and masks, novelty",Chapeaux et masques de déguisement
9505909000,9505.90.90.00,9505.90.90.00 (1988-01/1997-12),198801,199712,,N/A (1988-01/1997-12),198801,199712,"Festive, carnival or other entertainment articles incl tricks and jokes, nes","Articles de fêtes,carnaval ou au divertissements,incl de magie et surprises,nda"
9506110000,9506.11.00.00,9506.11.00.00 (2019-01/9999-12),201901,999912,PAR,PAR (2019-01/9999-12),201901,999912,Snow-skis,Skis de neige
9506110010,9506.11.00.10,9506.11.00.10 (1988-01/1994-12),198801,199412,PAR,PAR (1988-01/1994-12),198801,199412,"Skis, downhill","Skis alpins, de descente"
9506110020,9506.11.00.20,9506.11.00.20 (1988-01/1994-12),198801,199412,PAR,PAR (1988-01/1994-12),198801,199412,"Skis, cross country",Skis de fond
9506110090,9506.11.00.90,9506.11.00.90 (1988-01/1994-12),198801,199412,PAR,PAR (1988-01/1994-12),198801,199412,"Skis, snow, o/t downhill or cross country","Skis de neige, a/q skis alpins, de descente ou de fond"
9506111000,9506.11.10.00,9506.11.10.00 (1995-01/2018-12),199501,201812,PAR,PAR (1995-01/2018-12),199501,201812,"Skis, downhill","Skis alpin, de descente"
9506119000,9506.11.90.00,9506.11.90.00 (2017-01/2018-12),201701,201812,,N/A (2017-01/2018-12),201701,201812,"Snow-skis, other than downhill skis","Skis de neige, autres que skis alpin"
9506119010,9506.11.90.10,9506.11.90.10 (1995-01/2016-12),199501,201612,PAR,PAR (1995-01/2016-12),199501,201612,"Skis, cross country",Skis de fond
9506119020,9506.11.90.20,9506.11.90.20 (2000-01/2016-12),200001,201612,NMB,NMB (2000-01/2016-12),200001,201612,Snowboards,Planches à neige
9506119090,9506.11.90.90,9506.11.90.90 (1995-01/1999-12),199501,199912,PAR,PAR (1995-01/1999-12),199501,199912,"Skis, snow, o/t downhill or cross country","Skis de neige, a/q skis alpin ou skis de fond"
9506119090,9506.11.90.90,9506.11.90.90 (2000-01/2016-12),200001,201612,PAR,PAR (2000-01/2016-12),200001,201612,"Skis, snow, o/t downhill, cross country or snowboards","Skis de neige, a/q skis alpin, skis de fond ou planches à neige"
9506120000,9506.12.00.00,9506.12.00.00 (1988-01/9999-12),198801,999912,,N/A (1988-01/9999-12),198801,999912,Snow-ski-fastenings (ski-bindings),Fixations pour skis de neige
9506190000,9506.19.00.00,9506.19.00.00 (2017-01/9999-12),201701,999912,,N/A (2017-01/9999-12),201701,999912,"Snow-ski equipment, o/t skis and ski-fastenings, ski-bindings","Matériel pr la pratique du ski de neige, a/q les skis et les fixations pour skis"
9506190010,9506.19.00.10,9506.19.00.10 (1998-01/2016-12),199801,201612,PAR,PAR (1998-01/2016-12),199801,201612,Ski poles,Bâtons de ski
9506190090,9506.19.00.90,9506.19.00.90 (1998-01/2016-12),199801,201612,,N/A (1998-01/2016-12),199801,201612,"Snow-ski equipment, nes","Équipement pour ski de neige, nda"
9506191000,9506.19.10.00,9506.19.10.00 (1988-01/1997-12),198801,199712,,N/A (1988-01/1989-12),198801,198912,Ski poles,Bâtons de ski
9506191000,9506.19.10.00,9506.19.10.00 (1988-01/1997-12),198801,199712,PAR,PAR (1990-01/1997-12),199001,199712,Ski poles,Bâtons de ski
9506199000,9506.19.90.00,9506.19.90.00 (1988-01/1997-12),198801,199712,,N/A (1988-01/1997-12),198801,199712,"Snow-ski equipment, nes","Équipement pour ski de neige, nda"
9506210000,9506.21.00.00,9506.21.00.00 (1988-01/9999-12),198801,999912,,N/A (1988-01/9999-12),198801,999912,Sailboards,Planches à voile
9506290000,9506.29.00.00,9506.29.00.00 (2012-01/9999-12),201201,999912,,N/A (2012-01/9999-12),201201,999912,"Water-skis, surf-boards & other water-sport equipment, other than sailboards,nes","Skis nautiques, aquaplanes & au mat pour sport nautique, a/q planche à voile,nda"
9506290010,9506.29.00.10,9506.29.00.10 (1988-01/2011-12),198801,201112,,N/A (1988-01/2011-12),198801,201112,"Skis, water",Skis nautiques
9506290020,9506.29.00.20,9506.29.00.20 (1988-01/2011-12),198801,201112,,N/A (1988-01/2011-12),198801,201112,"Fins, water-sport",Palmes pour la natation
9506290090,9506.29.00.90,9506.29.00.90 (1988-01/2011-12),198801,201112,,N/A (1988-01/2011-12),198801,201112,"Surfboards and other water-sport equipment, nes","Aquaplanes et autre matériel de sports nautiques, nda"
9506310010,9506.31.00.10,9506.31.00.10 (1988-01/9999-12),198801,999912,NMB,NMB (1988-01/9999-12),198801,999912,"Golf clubs, individual","Bâtons de golf, à l'unité"
9506310020,9506.31.00.20,9506.31.00.20 (1988-01/9999-12),198801,999912,NMB,NMB (1988-01/9999-12),198801,999912,"Golf clubs, in sets",Ensembles de bâtons de golf
9506320000,9506.32.00.00,9506.32.00.00 (2019-01/9999-12),201901,999912,NMB,NMB (2019-01/9999-12),201901,999912,Golf balls,Balles de golf
9506321000,9506.32.10.00,9506.32.10.00 (1988-01/2018-12),198801,201812,DZN,DZN (1988-01/2018-12),198801,201812,"Balls, golf, hollow, for practice","Balles de golf creuses, d'entraînement"
9506329000,9506.32.90.00,9506.32.90.00 (1988-01/2018-12),198801,201812,DZN,DZN (1988-01/2018-12),198801,201812,"Balls, golf, o/t hollow","Balles de golf, a/q creuses"
9506390000,9506.39.00.00,9506.39.00.00 (2019-01/9999-12),201901,999912,,N/A (2019-01/9999-12),201901,999912,"Golf equipment, nes","Matériel pour le golf, nda"
9506391000,9506.39.10.00,9506.39.10.00 (2012-01/2018-12),201201,201812,,N/A (2012-01/2018-12),201201,201812,"Finished grips, for manufacture of golf clubs; shafts of steel or graphite","Poignées finies pr fab club de golf; manches de bâtons de golf,en acier/graphite"
9506391010,9506.39.10.10,9506.39.10.10 (1988-01/1997-12),198801,199712,,N/A (1988-01/1997-12),198801,199712,"Golf club shafts, seamless steel, not plated","Manches de bâtons de golf, en acier sans soudure non plaqué"
9506391010,9506.39.10.10,9506.39.10.10 (1998-01/2011-12),199801,201112,,N/A (1998-01/2011-12),199801,201112,Finished grips for use in the manufacture of golf clubs,Poignées finies devant servir à la fabrication de clubs de golf
9506391021,9506.39.10.21,9506.39.10.21 (1998-01/2011-12),199801,201112,,N/A (1998-01/2011-12),199801,201112,"Golf club shafts, seamless steel, not plated","Manches de bâtons de golf, en acier sans soudure, non plaqué"
9506391029,9506.39.10.29,9506.39.10.29 (1998-01/2011-12),199801,201112,,N/A (1998-01/2011-12),199801,201112,"Golf club shafts, o/t seamless steel, not plated","Manches de bâtons de golf, a/q en acier sans soudure, non plaqué"
9506391090,9506.39.10.90,9506.39.10.90 (1988-01/1997-12),198801,199712,,N/A (1988-01/1997-12),198801,199712,"Golf club shafts, o/t seamless steel, not plated","Manches de bâtons de golf, a/q en acier sans soudure non plaqué"
9506392000,9506.39.20.00,9506.39.20.00 (1988-01/2018-12),198801,201812,,N/A (1988-01/2018-12),198801,201812,Golf club shafts and heads of wood,Manches et têtes de bâtons de golf en bois
9506393000,9506.39.30.00,9506.39.30.00 (1988-01/2018-12),198801,201812,,N/A (1988-01/2018-12),198801,201812,"Golf forged heads, of iron/steel, not ground, polished, plated or o/w finished","Têtes de bâtons de golf,fer/acier forgés,ni meulées,polies,plaquées ou au finies"
9506399010,9506.39.90.10,9506.39.90.10 (1988-01/1997-12),198801,199712,,N/A (1988-01/1997-12),198801,199712,Golf club grips,Poignées de bâtons de golf
9506399010,9506.39.90.10,9506.39.90.10 (1998-01/2018-12),199801,201812,,N/A (1998-01/2018-12),199801,201812,"Parts of golf clubs, nes","Parties de clubs de golf, nda"
9506399020,9506.39.90.20,9506.39.90.20 (1990-01/1997-12),199001,199712,,N/A (1990-01/1997-12),199001,199712,"Parts of golf clubs, nes","Parties pour bâtons de golf, nda"
9506399090,9506.39.90.90,9506.39.90.90 (1988-01/1989-12),198801,198912,,N/A (1988-01/1989-12),198801,198912,"Parts of golf equipment, o/t golf clubs & balls","Parties pour matériel de golf, a/q bâtons et balles"
9506399090,9506.39.90.90,9506.39.90.90 (1990-01/2018-12),199001,201812,,N/A (1990-01/2018-12),199001,201812,"Parts of golf equipment, o/t golf clubs & balls","Parties pour matériel de golf, a/q bâtons et balles"
9506400000,9506.40.00.00,9506.40.00.00 (2012-01/9999-12),201201,999912,,N/A (2012-01/9999-12),201201,999912,Articles and equipment for table-tennis,Articles et matériel pour le tennis de table
9506400010,9506.40.00.10,9506.40.00.10 (1988-01/2011-12),198801,201112,DZN,DZN (1988-01/2011-12),198801,201112,"Balls, table-tennis","Balles de ping-pong, tennis de table"
9506400020,9506.40.00.20,9506.40.00.20 (1988-01/2011-12),198801,201112,NMB,NMB (1988-01/2011-12),198801,201112,"Paddles, bats, table-tennis","Palettes, raquettes, de ping-pong, tennis de table"
9506400090,9506.40.00.90,9506.40.00.90 (1988-01/2011-12),198801,201112,,N/A (1988-01/2011-12),198801,201112,Articles and equipment for table-tennis o/t balls or paddles (bats),"Articles et matériel pour ping-pong, tennis de table, a/q balles ou raquettes"
9506510000,9506.51.00.00,9506.51.00.00 (1988-01/9999-12),198801,999912,,N/A (1988-01/1991-12),198801,199112,"Rackets, lawn-tennis, whether or not strung","Raquettes de tennis, même non cordées"
9506510000,9506.51.00.00,9506.51.00.00 (1988-01/9999-12),198801,999912,NMB,NMB (1992-01/9999-12),199201,999912,"Rackets, lawn-tennis, whether or not strung","Raquettes de tennis, même non cordées"
9506590010,9506.59.00.10,9506.59.00.10 (1988-01/1992-02),198801,199202,,N/A (1988-01/1992-02),198801,199202,"Rackets, badminton, whether or not strung","Raquettes de badminton, même non cordées"
9506590090,9506.59.00.90,9506.59.00.90 (1988-01/1992-02),198801,199202,,N/A (1988-01/1992-02),198801,199202,"Rackets, o/t badminton or lawn tennis, whether or not strung,nes","Raquettes, a/q de tennis ou de badminton, même cordées, nda"
9506591000,9506.59.10.00,9506.59.10.00 (2012-01/9999-12),201201,999912,NMB,NMB (2012-01/9999-12),201201,999912,"Squash, badminton or racketball, whether or not strung","Raquettes de squash, de badminton ou de racketball, même non cordées"
9506591010,9506.59.10.10,9506.59.10.10 (1992-03/2011-12),199203,201112,NMB,NMB (1992-03/2011-12),199203,201112,"Rackets, squash, whether or not strung","Raquettes de squash, même non cordées"
9506591020,9506.59.10.20,9506.59.10.20 (1992-03/1997-12),199203,199712,NMB,NMB (1992-03/1997-12),199203,199712,"Rackets, racketball, whether or not strung","Raquettes de racketball, même non cordées"
9506591020,9506.59.10.20,9506.59.10.20 (1998-01/2011-12),199801,201112,NMB,NMB (1998-01/2011-12),199801,201112,"Rackets, badminton, whether or not strung","Raquettes de badminton, même non cordées"
9506591030,9506.59.10.30,9506.59.10.30 (1998-01/2011-12),199801,201112,NMB,NMB (1998-01/2011-12),199801,201112,"Rackets, racketball, whether or not strung","Raquettes de racketball, même non cordées"
9506599000,9506.59.90.00,9506.59.90.00 (1998-01/9999-12),199801,999912,NMB,NMB (1998-01/9999-12),199801,999912,"Rackets,o/t lawn-tennis,squash,racketball & badminton, w/n strung, nes","Raquettes, a/q tennis,squash,racketball & badminton,même non cordées, nda"
9506599010,9506.59.90.10,9506.59.90.10 (1992-03/1995-06),199203,199506,NMB,NMB (1992-03/1995-06),199203,199506,"Rackets, badminton, whether or not strung","Raquettes de badminton,même non cordées"
9506599090,9506.59.90.90,9506.59.90.90 (1992-03/1995-06),199203,199506,NMB,NMB (1992-03/1995-06),199203,199506,"Rackets, o/t lawn-tennis,squash,racketball & badminton, w/n strung, nes","Raquettes a/q tennis,squash,racketball & badminton, même non cordées, nda"
9506599100,9506.59.91.00,9506.59.91.00 (1995-07/1997-12),199507,199712,NMB,NMB (1995-07/1997-12),199507,199712,"Rackets,badminton,whether or not strung","Raquettes de badminton,même non cordées"
9506599900,9506.59.99.00,9506.59.99.00 (1995-07/1997-12),199507,199712,NMB,NMB (1995-07/1997-12),199507,199712,"Rackets,o/t lawn-tennis,squash,racketball & badminton, w/n strung,nes","Raquettes a/q tennis,squash,racketball & badminton,même non cordées,nda"
9506610000,9506.61.00.00,9506.61.00.00 (1988-01/9999-12),198801,999912,DZN,DZN (1988-01/9999-12),198801,999912,"Balls, lawn-tennis",Balles de tennis
9506620010,9506.62.00.10,9506.62.00.10 (1988-01/1992-02),198801,199202,DZN,DZN (1988-01/1992-02),198801,199202,"Basketballs, inflatable","Balles de basket-ball, gonflables"
9506620010,9506.62.00.10,9506.62.00.10 (2019-01/9999-12),201901,999912,NMB,NMB (2019-01/9999-12),201901,999912,"Basketballs, inflatable","Ballons de basket-ball, gonflables"
9506620020,9506.62.00.20,9506.62.00.20 (1988-01/1992-02),198801,199202,DZN,DZN (1988-01/1992-02),198801,199202,"Volleyballs, inflatable","Balles de volley-ball, gonflables"
9506620020,9506.62.00.20,9506.62.00.20 (2019-01/9999-12),201901,999912,NMB,NMB (2019-01/9999-12),201901,999912,"Soccer balls, inflatable","Ballons de soccer, gonflables"
9506620030,9506.62.00.30,9506.62.00.30 (1988-01/1992-02),198801,199202,DZN,DZN (1988-01/1992-02),198801,199202,"Soccer balls, inflatable","Ballons de football (européen), gonflables"
9506620040,9506.62.00.40,9506.62.00.40 (1988-01/1992-02),198801,199202,DZN,DZN (1988-01/1992-02),198801,199202,"Footballs, nes, including rugby balls, inflatable","Ballons de football, nda, incl ballons et balles de rugby, gonflables"
9506620090,9506.62.00.90,9506.62.00.90 (1988-01/1992-02),198801,199202,DZN,DZN (1988-01/1992-02),198801,199202,"Balls for sports, inflatable, nes","Ballons de sport, gonflables, nda"
9506620090,9506.62.00.90,9506.62.00.90 (2019-01/9999-12),201901,999912,NMB,NMB (2019-01/9999-12),201901,999912,"Balls for sports, inflatable, nes","Ballons de sport, gonflables, nda"
9506621010,9506.62.10.10,9506.62.10.10 (1992-03/1997-12),199203,199712,DZN,DZN (1992-03/1997-12),199203,199712,"Basketballs, inflatable","Ballons de basket-ball, gonflables"
9506621010,9506.62.10.10,9506.62.10.10 (1998-01/2011-12),199801,201112,DZN,DZN (1998-01/2011-12),199801,201112,"Inflatable balls, for the training of children with intellectual disabilities","Ballons gonflables, pr la formation d'enfants avec handicaps intellectuels"
9506621020,9506.62.10.20,9506.62.10.20 (1992-03/1997-12),199203,199712,DZN,DZN (1992-03/1997-12),199203,199712,"Volleyballs, inflatable","Ballons de volley-ball, gonflables"
9506621020,9506.62.10.20,9506.62.10.20 (1998-01/2018-12),199801,201812,DZN,DZN (1998-01/2018-12),199801,201812,"Basketballs, inflatable","Ballons de basket-ball, gonflables"
9506621030,9506.62.10.30,9506.62.10.30 (1992-03/1997-12),199203,199712,DZN,DZN (1992-03/1997-12),199203,199712,"Soccer balls, inflatable","Ballons de soccer, gonflables"
9506621030,9506.62.10.30,9506.62.10.30 (1998-01/2011-12),199801,201112,DZN,DZN (1998-01/2011-12),199801,201112,"Volleyballs, inflatable","Ballons de volley-ball, gonflables"
9506621040,9506.62.10.40,9506.62.10.40 (1992-03/1993-03),199203,199303,DZN,DZN (1992-03/1993-03),199203,199303,"Squash balls, inflatable","Balles de squash, gonflables"
9506621040,9506.62.10.40,9506.62.10.40 (1998-01/2018-12),199801,201812,DZN,DZN (1998-01/2018-12),199801,201812,"Soccer balls, inflatable","Ballons de soccer, gonflables"
9506621050,9506.62.10.50,9506.62.10.50 (1992-03/1993-03),199203,199303,DZN,DZN (1992-03/1993-03),199203,199303,"Racketballs, inflatable","Balles de racketball, gonflables"
9506621090,9506.62.10.90,9506.62.10.90 (2012-01/2018-12),201201,201812,DZN,DZN (2012-01/2018-12),201201,201812,"Inflatable ball, for training child with intellectual disability; for volleyball","Ballon gonflable,pour formation d'enfant a handicap intellectuel; de volley-ball"
9506629000,9506.62.90.00,9506.62.90.00 (2012-01/2018-12),201201,201812,DZN,DZN (2012-01/2018-12),201201,201812,"Balls for sports, inflatable, nes","Ballons de sport, gonflables, nda"
9506629010,9506.62.90.10,9506.62.90.10 (1992-03/2011-12),199203,201112,DZN,DZN (1992-03/2011-12),199203,201112,"Footballs, nes, including rugby balls, inflatable","Ballons de football, nda, y compris ballons et balles de rugby gonflables"
9506629090,9506.62.90.90,9506.62.90.90 (1992-03/1993-03),199203,199303,DZN,DZN (1992-03/1993-03),199203,199303,"Balls for sports, inflatable, nes","Ballons de sport, gonflables, nda"
9506629090,9506.62.90.90,9506.62.90.90 (1993-04/1997-12),199304,199712,DZN,DZN (1993-04/1997-12),199304,199712,"Balls for sports, inflatable, nes","Ballons de sport, gonflables, nda"
9506629090,9506.62.90.90,9506.62.90.90 (1998-01/2011-12),199801,201112,DZN,DZN (1998-01/2011-12),199801,201112,"Balls for sports, inflatable, nes","Ballons de sport, gonflables, nda"
9506690000,9506.69.00.00,9506.69.00.00 (2019-01/9999-12),201901,999912,NMB,NMB (2019-01/9999-12),201901,999912,"Balls, nes","Ballons et balles, nda"
9506691000,9506.69.10.00,9506.69.10.00 (1988-01/2018-12),198801,201812,DZN,DZN (1988-01/2018-12),198801,201812,"Balls, cricket",Balles de cricket
9506692000,9506.69.20.00,9506.69.20.00 (1988-10/1993-03),198810,199303,DZN,DZN (1988-10/1993-03),198810,199303,"Balls, for lawn or carpet bowling",Boules pour jeux de boules boulingrin ou jeux de boules sur tapis
9506692000,9506.69.20.00,9506.69.20.00 (2012-01/2018-12),201201,201812,DZN,DZN (2012-01/2018-12),201201,201812,"Balls for lawn or carpet bowling, croquet, squash or raquetball","Balle pr jeu de boule sur pelouse/intérieur & balle de croquet,squash/racketball"
9506692010,9506.69.20.10,9506.69.20.10 (1993-04/2011-12),199304,201112,DZN,DZN (1993-04/2011-12),199304,201112,"Balls, for lawn or carpet bowling","Boules, pour jeux de boules sur pelouse ou d'intérieur"
9506692020,9506.69.20.20,9506.69.20.20 (1993-04/2011-12),199304,201112,DZN,DZN (1993-04/2011-12),199304,201112,"Balls, squash",Balles de squash
9506692030,9506.69.20.30,9506.69.20.30 (1993-04/2011-12),199304,201112,DZN,DZN (1993-04/2011-12),199304,201112,"Balls, racketball",Balles de racketball
9506692040,9506.69.20.40,9506.69.20.40 (1998-01/2011-12),199801,201112,DZN,DZN (1998-01/2011-12),199801,201112,Croquet balls,Boules de croquets
9506693000,9506.69.30.00,9506.69.30.00 (1995-07/1997-12),199507,199712,DZN,DZN (1995-07/1997-12),199507,199712,Croquet balls,Boules de croquets
9506699000,9506.69.90.00,9506.69.90.00 (2012-01/2018-12),201201,201812,DZN,DZN (2012-01/2018-12),201201,201812,"Balls for sports, other than inflatable, nes","Balles de sport, autres que gonflables, nda"
9506699010,9506.69.90.10,9506.69.90.10 (1988-01/2011-12),198801,201112,DZN,DZN (1988-01/2011-12),198801,201112,Baseballs and softballs,Balles de base-ball et balle-molle
9506699090,9506.69.90.90,9506.69.90.90 (1988-01/1988-09),198801,198809,DZN,DZN (1988-01/1988-09),198801,198809,"Balls for sports, o/t inflatable, nes","Balles de sport, a/q gonflables, nda"
9506699090,9506.69.90.90,9506.69.90.90 (1988-10/1995-06),198810,199506,DZN,DZN (1988-10/1995-06),198810,199506,"Balls for sports, o/t inflatable, nes","Balles de sport, a/q gonflables, nda"
9506699090,9506.69.90.90,9506.69.90.90 (1995-07/2011-12),199507,201112,DZN,DZN (1995-07/2011-12),199507,201112,"Balls for sports, o/t inflatable, nes","Balles de sport, a/q gonflables, nda"
9506701010,9506.70.10.10,9506.70.10.10 (1988-01/1993-12),198801,199312,PAR,PAR (1988-01/1993-12),198801,199312,"Skates, ice, attached to boots","Patins à glace, montés sur chaussures"
9506701020,9506.70.10.20,9506.70.10.20 (1988-01/1993-12),198801,199312,PAR,PAR (1988-01/1993-12),198801,199312,"Skates, roller, attached to boots","Patins à roulettes, montés sur chaussures"
9506701100,9506.70.11.00,9506.70.11.00 (1994-01/9999-12),199401,999912,PAR,PAR (1994-01/9999-12),199401,999912,"Skates, ice, attached to boots or other footwear","Patins à glace, montés sur chaussures ou d'autres types de chaussures"
9506701200,9506.70.12.00,9506.70.12.00 (1994-01/9999-12),199401,999912,PAR,PAR (1994-01/9999-12),199401,999912,"Skates, roller, attached to boots or other footwear","Patins à roulettes, montés sur chaussures ou d'autres types de chaussures"
9506702000,9506.70.20.00,9506.70.20.00 (2012-01/9999-12),201201,999912,,N/A (2012-01/9999-12),201201,999912,Ice or roller skates not attached to boots or to other footwear,"Patins à glace ou à roulettes, non montés sur botte ou autres type de chaussures"
9506702010,9506.70.20.10,9506.70.20.10 (1988-01/2011-12),198801,201112,PAR,PAR (1988-01/2011-12),198801,201112,"Skates, ice, not attached to boots or other footwear","Patins à glace, non montés sur chaussures ou d'autres types de chaussures"
9506702020,9506.70.20.20,9506.70.20.20 (1988-01/2011-12),198801,201112,PAR,PAR (1988-01/2011-12),198801,201112,"Skates, roller, not attached to boots or other footwear","Patins à roulettes, non montés sur chaussures ou d'autres types de chaussures"
9506702090,9506.70.20.90,9506.70.20.90 (1988-01/2011-12),198801,201112,,N/A (1988-01/2011-12),198801,201112,Parts and accessories of ice or roller skates not attached to boots,Parties et acces pour patins à glace ou à roulettes non montés sur chaussures
9506910010,9506.91.00.10,9506.91.00.10 (2019-01/2021-12),201901,202112,NMB,NMB (2019-01/2021-12),201901,202112,Exercise bicycle,Bicyclettes d'exercices
9506910010,9506.91.00.10,9506.91.00.10 (2022-01/9999-12),202201,999912,NMB,NMB (2022-01/9999-12),202201,999912,"Articles and equip,of exercise bicycles,f physical exercise,gymnastics/athletics","Articles et mat,bicyclettes exercices,pr culture physique,gymnastique/athlétisme"
9506910020,9506.91.00.20,9506.91.00.20 (2019-01/9999-12),201901,999912,NMB,NMB (2019-01/9999-12),201901,999912,Trampolines,Trampolines
9506910090,9506.91.00.90,9506.91.00.90 (2019-01/2021-12),201901,202112,,N/A (2019-01/2021-12),201901,202112,"Articles & equipment for general physical exercise, gymnastics or athletics, nes","Articles et matériel pr la culture physique, la gymnastique ou l'athlétisme, nda"
9506910090,9506.91.00.90,9506.91.00.90 (2022-01/9999-12),202201,999912,,N/A (2022-01/9999-12),202201,999912,"Art & equip,o/t exercise bicycles/trampolines, physical exerc,gym/athletics, nes","Art & mat,a/q bicycle exercices/tramoline,pr culture physique,gym/athlétisme,nda"
9506911000,9506.91.10.00,9506.91.10.00 (1988-01/1997-12),198801,199712,,N/A (1988-01/1997-12),198801,199712,"Gymnasium or athletic articles and equipment, of leather","Articles et matériel de gymnastique ou d'athlétisme, en cuir"
9506911010,9506.91.10.10,9506.91.10.10 (2017-01/2018-12),201701,201812,NMB,NMB (2017-01/2018-12),201701,201812,Exercise bicycle,Bicyclettes d'exercices
9506911011,9506.91.10.11,9506.91.10.11 (1998-01/1998-06),199801,199806,NMB,NMB (1998-01/1998-06),199801,199806,"Muscular/cardiovascular exercise bicycle,w bars f shoulder/arm,w electrn monitor","Bicycle,exer musculaire/cardio-vasculaire,condi épaule/bras,a indicateur électro"
9506911011,9506.91.10.11,9506.91.10.11 (1998-07/2016-12),199807,201612,NMB,NMB (1998-07/2016-12),199807,201612,"Exercise bicycles, with electronic monitors",Bicyclette d'exercices avec indicateurs électroniques de contrôle
9506911019,9506.91.10.19,9506.91.10.19 (1998-01/1998-06),199801,199806,NMB,NMB (1998-01/1998-06),199801,199806,"Musc/cardiovascular exercise bicycle,w bars f shoulder/arm, w/o electrn monitor","Bicycle,exer musc/cardio-vasculaire,condi épaule/bras, sans indicateur électro"
9506911019,9506.91.10.19,9506.91.10.19 (1998-07/2016-12),199807,201612,NMB,NMB (1998-07/2016-12),199807,201612,"Exercise bicycle, w/o electronic monitor","Bicyclettes d'exercices, sans indicateur électronique"
9506911020,9506.91.10.20,9506.91.10.20 (1998-01/1998-08),199801,199808,,N/A (1998-01/1998-08),199801,199808,Parts for use in the manufacture of physical exercise machines,Parties du type utilisé dans les appareils d'exercice physique
9506911020,9506.91.10.20,9506.91.10.20 (1998-09/2016-12),199809,201612,NMB,NMB (1998-09/2016-12),199809,201612,Stair climbing machines,Appareils d'escaliers d'exercice
9506911080,9506.91.10.80,9506.91.10.80 (2012-01/2016-12),201201,201612,,N/A (2012-01/2016-12),201201,201612,Parts for use in the manufacture of physical exercise machines,Parties du type utilisé dans les appareils d'exercice physique
9506911090,9506.91.10.90,9506.91.10.90 (1998-09/2011-12),199809,201112,,N/A (1998-09/2011-12),199809,201112,Parts for use in the manufacture of physical exercise machines,Parties du type utilisé dans les appareils d'exercice physique
9506911090,9506.91.10.90,9506.91.10.90 (2017-01/2018-12),201701,201812,,N/A (2017-01/2018-12),201701,201812,Parts for use in the manufacture of physical exercise machines; stair climbing,Parties pr fab appareils d'exercice physique; appareils d'escaliers d'exercice
9506912010,9506.91.20.10,9506.91.20.10 (1988-11/1997-12),198811,199712,NMB,NMB (1988-11/1997-12),198811,199712,"Cycling excercise apparatus, equipped with electronic monitors",Cycles d'exerciseurs munis d'indicateurs électroniques de contrôles
