3912200000,3912.20.00.00,3912.20.00.00 (2012-01/9999-12),201201,999912,KGM,KGM (2012-01/9999-12),201201,999912,"Cellulose nitrates, including collodions, in primary forms","Nitrates de cellulose, y compris les collodions, sous formes primaires"
3912200010,3912.20.00.10,3912.20.00.10 (1988-01/1997-12),198801,199712,KGM,KGM (1988-01/1997-12),198801,199712,"Cellulose nitrates, including collodions, of a kind used in explosives","Nitrates de cellulose, incl collodions, type utilisé dans les explosifs"
3912200090,3912.20.00.90,3912.20.00.90 (1988-01/1997-12),198801,199712,KGM,KGM (1988-01/1997-12),198801,199712,"Cellulose nitrates, including collodions, nes, in primary forms","Nitrates de cellulose, incl collodions, nda, sous formes primaires"
3912201010,3912.20.10.10,3912.20.10.10 (1998-01/2011-12),199801,201112,KGM,KGM (1998-01/2011-12),199801,201112,"Cellulose nitrates, including collodions, of a kind used in explosives","Nitrates de cellulose, incl collodions, type utilisé dans les explosifs"
3912201090,3912.20.10.90,3912.20.10.90 (1998-01/2011-12),199801,201112,KGM,KGM (1998-01/2011-12),199801,201112,"Cellulose nitrate wetted w dibutyl phthalate/compstn,excl wetted w orgn solvent",Nitrate cellulose mouillé a phtalate dibutylique/comps exc mouillé a solvent org
3912209000,3912.20.90.00,3912.20.90.00 (1998-01/2011-12),199801,201112,KGM,KGM (1998-01/2011-12),199801,201112,"Cellulose nitrates, including collodions, nes, in primary forms","Nitrates de cellulose, incl collodions, nda, sous formes primaires"
3912310000,3912.31.00.00,3912.31.00.00 (1988-01/9999-12),198801,999912,KGM,KGM (1988-01/9999-12),198801,999912,"Carboxymethylcellulose and its salts, in primary forms","Carboxyméthylcellulose et ses sels, sous formes primaires"
3912390010,3912.39.00.10,3912.39.00.10 (2012-01/9999-12),201201,999912,KGM,KGM (2012-01/9999-12),201201,999912,"Hydroxyethyl cellulose, in primary forms","Hydroxyéthyl cellulose, sous formes primaires"
3912390090,3912.39.00.90,3912.39.00.90 (2012-01/9999-12),201201,999912,KGM,KGM (2012-01/9999-12),201201,999912,"Other cellulose ethers, in primary forms, nes","Other éthers de cellulose, sous formes primaires, nda"
3912391000,3912.39.10.00,3912.39.10.00 (1988-01/1997-12),198801,199712,KGM,KGM (1988-01/1997-12),198801,199712,"Cellulose ethers, moulding compositions","Éthers de cellulose, compositions de moulage"
3912391010,3912.39.10.10,3912.39.10.10 (1998-01/2011-12),199801,201112,KGM,KGM (1998-01/2011-12),199801,201112,"Composition of methylcellulose, excluding moulding compositions","Composition de méthylcellulose, excluant compositions à mouler"
3912391020,3912.39.10.20,3912.39.10.20 (1998-01/2011-12),199801,201112,KGM,KGM (1998-01/2011-12),199801,201112,"Composition of ethyl cellulose, excluding moulding compositions","Composition d'ethylcellulose, excluant composition à mouler"
3912391030,3912.39.10.30,3912.39.10.30 (1998-01/2011-12),199801,201112,KGM,KGM (1998-01/2011-12),199801,201112,"Composition of hydroxyethylcellulose, excluding moulding composition","Composition d'hydroxyéthylcellulose, excluant composition à mouler"
3912391090,3912.39.10.90,3912.39.10.90 (1998-01/2011-12),199801,201112,KGM,KGM (1998-01/2011-12),199801,201112,"Composition of cellulose ethers, nes, excluding moulding compositions","Composition d'éthers de cellulose, nda, excluant composition à mouler"
3912399000,3912.39.90.00,3912.39.90.00 (1998-01/2011-12),199801,201112,KGM,KGM (1998-01/2011-12),199801,201112,"Cellulose ethers, moulding compositions, nes","Éthers de cellulose, compositions de moulage, nda"
3912399010,3912.39.90.10,3912.39.90.10 (1988-01/1997-12),198801,199712,KGM,KGM (1988-01/1997-12),198801,199712,"Methylcellulose, in primary forms","Méthylcellulose, sous formes primaires"
3912399020,3912.39.90.20,3912.39.90.20 (1988-01/1997-12),198801,199712,KGM,KGM (1988-01/1997-12),198801,199712,"Ethyl cellulose, in primary forms","Éthylcellulose, sous formes primaires"
3912399030,3912.39.90.30,3912.39.90.30 (1988-01/1997-12),198801,199712,KGM,KGM (1988-01/1997-12),198801,199712,"Hydroxyethylcellulose, in primary forms","Hydroxyéthylcellulose, sous formes primaires"
3912399090,3912.39.90.90,3912.39.90.90 (1988-01/1997-12),198801,199712,KGM,KGM (1988-01/1997-12),198801,199712,"Cellulose ethers, nes, in primary forms","Éthers de cellulose, nda, sous formes primaires"
3912900000,3912.90.00.00,3912.90.00.00 (2012-01/9999-12),201201,999912,KGM,KGM (2012-01/9999-12),201201,999912,"Cellulose derivatives, nes, in primary forms","Dérivés chimiques de cellulose, nda, sous formes primaires"
3912901010,3912.90.10.10,3912.90.10.10 (1988-01/2000-04),198801,200004,KGM,KGM (1988-01/2000-04),198801,200004,"Cellulose acetate butyrate, moulding compositions","Acétobutyrate de cellulose, compositions de moulage"
3912901010,3912.90.10.10,3912.90.10.10 (2000-05/2011-12),200005,201112,KGM,KGM (2000-05/2011-12),200005,201112,Hydroxypropyl methylcellulose phthalate f use in coating pharmaceutical pellets,Phtalate d'hydroxypropyl méthylcellulose pr enrobage de granules phamaceutiques
3912901021,3912.90.10.21,3912.90.10.21 (2000-05/2011-12),200005,201112,KGM,KGM (2000-05/2011-12),200005,201112,"Cellulose acetate butyrate, moulding compositions","Acétobutyrate de cellulose, compositions de moulage"
3912901029,3912.90.10.29,3912.90.10.29 (2000-05/2011-12),200005,201112,KGM,KGM (2000-05/2011-12),200005,201112,"Cellulose and cellulose derivatives,nes, moulding compositions","Cellulose et dérivés de la cellulose, nda, compositions de moulage"
3912901090,3912.90.10.90,3912.90.10.90 (1988-01/2000-04),198801,200004,KGM,KGM (1988-01/2000-04),198801,200004,"Cellulose and cellulose derivatives,nes, moulding compositions","Cellulose et dérivés de la cellulose, nda, compositions de moulage"
3912909000,3912.90.90.00,3912.90.90.00 (1988-01/2000-04),198801,200004,KGM,KGM (1988-01/2000-04),198801,200004,"Cellulose and cellulose derivatives, nes, in primary forms","Cellulose et dérivés de la cellulose, nda, sous formes primaires"
3912909000,3912.90.90.00,3912.90.90.00 (2000-05/2011-12),200005,201112,KGM,KGM (2000-05/2011-12),200005,201112,"Cellulose and cellulose derivatives, nes, in primary forms","Cellulose et dérivés de la cellulose, nda, sous formes primaires"
3913100000,3913.10.00.00,3913.10.00.00 (2017-01/9999-12),201701,999912,KGM,KGM (2017-01/9999-12),201701,999912,"Alginic acid, its salts and esters, in primary forms","Acide alginique, ses sels et ses esters, sous formes primaires"
3913100010,3913.10.00.10,3913.10.00.10 (1988-01/2016-12),198801,201612,KGM,KGM (1988-01/2016-12),198801,201612,Alginic acid & compounds in primary forms,"Acide alginique et ses composés, sous formes primaires"
3913100020,3913.10.00.20,3913.10.00.20 (1988-01/2016-12),198801,201612,KGM,KGM (1988-01/2016-12),198801,201612,Alginic acid salts & esters in primary forms,"Sels et esters de l'acide alginique, sous formes primaires"
3913900010,3913.90.00.10,3913.90.00.10 (1988-01/1989-10),198801,198910,KGM,KGM (1988-01/1989-10),198801,198910,Hardened proteins in primary forms,Protéines durcies sous formes primaires
3913900010,3913.90.00.10,3913.90.00.10 (2012-01/9999-12),201201,999912,KGM,KGM (2012-01/9999-12),201201,999912,"Xanthan polysaccharide, in primary forms","Polysaccharide de xanthane, sous formes primaires"
3913900020,3913.90.00.20,3913.90.00.20 (1988-01/1989-10),198801,198910,KGM,KGM (1988-01/1989-10),198801,198910,Chemical derivatives of natural rubber in primary forms,Dérivés chimiques du caoutchouc naturel sous formes primaires
3913900030,3913.90.00.30,3913.90.00.30 (1988-01/1989-10),198801,198910,KGM,KGM (1988-01/1989-10),198801,198910,"Polysaccharides, in primary forms","Polysaccharides, sous formes primaires"
3913900080,3913.90.00.80,3913.90.00.80 (2012-01/9999-12),201201,999912,KGM,KGM (2012-01/9999-12),201201,999912,"Other polysaccharides, in primary forms, nes","Autres polysaccharides, sous formes primaires, nda"
3913900090,3913.90.00.90,3913.90.00.90 (1988-01/1989-10),198801,198910,KGM,KGM (1988-01/1989-10),198801,198910,"Natural polymers, modified natural polymers, nes, in primary forms","Polymères naturels, polymères naturels modifiés, nda, sous formes primaires"
3913900090,3913.90.00.90,3913.90.00.90 (2012-01/9999-12),201201,999912,KGM,KGM (2012-01/9999-12),201201,999912,"Natural polymers and modified natural polymers, in primary forms, nes","Polymères naturels et polymères naturels modifiés, sous formes primaires, nda"
3913901000,3913.90.10.00,3913.90.10.00 (1989-11/1997-12),198911,199712,KGM,KGM (1989-11/1997-12),198911,199712,Xanthan polysaccharide in primary forms,Polysaccharide de xanthane sous formes primaires
3913901010,3913.90.10.10,3913.90.10.10 (1998-01/2011-12),199801,201112,KGM,KGM (1998-01/2011-12),199801,201112,Xanthan polysaccharide in primary forms,Polysaccharide de xanthane sous formes primaires
3913901020,3913.90.10.20,3913.90.10.20 (1998-01/2011-12),199801,201112,KGM,KGM (1998-01/2011-12),199801,201112,"Chemical derivatives of natural rubber,incl moulding compstn but excl o compstn","Dérivés chimiques du caout naturel,y compris comps à mouler mais exc au comps"
3913901090,3913.90.10.90,3913.90.10.90 (1998-01/2011-12),199801,201112,KGM,KGM (1998-01/2011-12),199801,201112,"Nat & modified polymer, for use in the mfr of sera,antisera,toxoids,viruses,etc","Polymère naturel&modifié,devant servir fab sérum & antisérum,toxoïdes,virus,etc"
3913909010,3913.90.90.10,3913.90.90.10 (1989-11/1997-12),198911,199712,KGM,KGM (1989-11/1997-12),198911,199712,Hardened proteins in primary forms,Protéines durcies sous formes primaires
3913909010,3913.90.90.10,3913.90.90.10 (1998-01/2011-12),199801,201112,KGM,KGM (1998-01/2011-12),199801,201112,"Other polysaccharides, nes, in primary forms","Autres polysaccharides, nda, sous formes primaires"
3913909020,3913.90.90.20,3913.90.90.20 (1989-11/1997-12),198911,199712,KGM,KGM (1989-11/1997-12),198911,199712,Chemical derivatives of natural rubber in primary forms,Dérivés chimiques du caoutchouc naturel sous formes primaires
3913909020,3913.90.90.20,3913.90.90.20 (1998-01/2011-12),199801,201112,KGM,KGM (1998-01/2011-12),199801,201112,"Chemical derivatives of natural rubber, nes, in primary forms","Dérivés chimiques du caoutchouc naturel, nda, sous formes primaires"
3913909030,3913.90.90.30,3913.90.90.30 (1989-11/1997-12),198911,199712,KGM,KGM (1989-11/1997-12),198911,199712,"Other polysaccharides, nes, in primary forms","Autres polysaccharides, nda, sous formes primaires"
3913909030,3913.90.90.30,3913.90.90.30 (1998-01/2011-12),199801,201112,KGM,KGM (1998-01/2011-12),199801,201112,Hardened proteins in primary forms,Protéines durcies sous formes primaires
3913909090,3913.90.90.90,3913.90.90.90 (1989-11/1997-12),198911,199712,KGM,KGM (1989-11/1997-12),198911,199712,"Natural polymers, modified natural polymers, nes, in primary forms","Polymères naturels, polymères naturels modifiés, nda, sous formes primaires"
3913909090,3913.90.90.90,3913.90.90.90 (1998-01/2011-12),199801,201112,KGM,KGM (1998-01/2011-12),199801,201112,"Natural polymers, modified natural polymers, nes, in primary forms","Polymères naturels, polymères naturels modifiés, nda, sous formes primaires"
3914000000,3914.00.00.00,3914.00.00.00 (2017-01/9999-12),201701,999912,KGM,KGM (2017-01/9999-12),201701,999912,"Ion-exchangers based on polymers of Nos 39.01 to 39.13, in primary forms","Échangeurs d'ions à base de polymères des n°s 39.01 à 39.13, sous formes prim"
3914000010,3914.00.00.10,3914.00.00.10 (2012-01/2016-12),201201,201612,KGM,KGM (2012-01/2016-12),201201,201612,Non-macroporous polystyrene divinyl benzene cationic exchange resin compstn,Comps résine échangeur de cation en polystyrène divinylbenzène non macroporeux
3914000090,3914.00.00.90,3914.00.00.90 (2012-01/2016-12),201201,201612,KGM,KGM (2012-01/2016-12),201201,201612,"Ion-exchanger based on poly of hd39.01 to 39.13, excl poly styrene,prim form,nes","Échangeur d'ion, base polymère, a/q styrène,des pos 39.01 à 39.13,forme prim,nda"
3914001000,3914.00.10.00,3914.00.10.00 (1988-01/1997-12),198801,199712,KGM,KGM (1988-01/1997-12),198801,199712,Ion-exchangers based on polymers of styrene in primary forms,Échangeurs d'ions à base de polymères du styrène sous formes primaires
3914001000,3914.00.10.00,3914.00.10.00 (1998-01/2011-12),199801,201112,KGM,KGM (1998-01/2011-12),199801,201112,Non-macroporous poly(styrene-divinyl benzene) cationic exchange resin compstn,Comps résine échangeur de cation en poly (styrène-divinylbenzène)non-macroporeux
3914009000,3914.00.90.00,3914.00.90.00 (1988-01/1997-12),198801,199712,KGM,KGM (1988-01/1997-12),198801,199712,"Ion-exchangers based on poly of hd39.01 to 39.13,excl poly of styrene,prim form","Échangeurs d'ions, base polymères,a/q styrène, des n°s 39.01 à 39.13, for prim"
3914009000,3914.00.90.00,3914.00.90.00 (1998-01/2011-12),199801,201112,KGM,KGM (1998-01/2011-12),199801,201112,"Ion-exchanger based on poly of hd39.01 to 39.13, excl poly styrene,prim form,nes","Échangeur d'ion, base polymère, a/q styrène,des pos 39.01 à 39.13,forme prim,nda"
3915100000,3915.10.00.00,3915.10.00.00 (1988-01/9999-12),198801,999912,KGM,KGM (1988-01/9999-12),198801,999912,"Polyethylene waste,parings & scrap","Déchets, rognures et débris de polyéthylène"
3915200000,3915.20.00.00,3915.20.00.00 (1988-01/9999-12),198801,999912,KGM,KGM (1988-01/9999-12),198801,999912,"Polystyrene waste,parings & scrap","Déchets, rognures et débris de polystyrène"
3915300000,3915.30.00.00,3915.30.00.00 (1988-01/9999-12),198801,999912,KGM,KGM (1988-01/9999-12),198801,999912,"Polyvinyl chloride waste,parings & scrap","Déchets, rognures et débris de polychlorure de vinyle"
3915900010,3915.90.00.10,3915.90.00.10 (1998-01/9999-12),199801,999912,KGM,KGM (1998-01/9999-12),199801,999912,"Polypropylene or other polyolefins waste,parings & scrap","Déchets, rognures et débris de polypropylène ou autres polyoléfines"
3915900020,3915.90.00.20,3915.90.00.20 (1998-01/2011-12),199801,201112,KGM,KGM (1998-01/2011-12),199801,201112,"Polyvinyl acetate or other polyvinyl monomers waste,parings and scrap","Déchets, rognures, etc, de monomères d'acétate de polyvinyle ou autre polyvinyle"
3915900030,3915.90.00.30,3915.90.00.30 (1998-01/2011-12),199801,201112,KGM,KGM (1998-01/2011-12),199801,201112,"Polyacrylic waste,parings & scrap","Déchets, rognures et débris de polyacrylique"
3915900040,3915.90.00.40,3915.90.00.40 (1998-01/2011-12),199801,201112,KGM,KGM (1998-01/2011-12),199801,201112,"Polyacetals or other polyethers waste,parings & scrap","Déchets, rognures et débris de polyacétals ou autres polyéthers"
3915900050,3915.90.00.50,3915.90.00.50 (1998-01/2016-12),199801,201612,KGM,KGM (1998-01/2016-12),199801,201612,"Polycarbonates or other polyesters waste,parings & scrap","Déchets, rognures et débris de polycarbonates ou autres polyesters"
3915900060,3915.90.00.60,3915.90.00.60 (1998-01/2011-12),199801,201112,KGM,KGM (1998-01/2011-12),199801,201112,"Polyamides waste,parings & scrap","Déchets, rognures et débris de polyamides"
3915900070,3915.90.00.70,3915.90.00.70 (2012-01/2016-12),201201,201612,KGM,KGM (2012-01/2016-12),201201,201612,"Waste, parings and scrap of polyurethanes","Déchets, rognures et débris de polyuréthanes"
3915900071,3915.90.00.71,3915.90.00.71 (1998-01/2011-12),199801,201112,KGM,KGM (1998-01/2011-12),199801,201112,"Polyurethane in cellular form, waste,parings & scrap","Déchets, rognures et débris de polyuréthane sous forme alvéolaire"
3915900079,3915.90.00.79,3915.90.00.79 (1998-01/2011-12),199801,201112,KGM,KGM (1998-01/2011-12),199801,201112,"Other polyurethanes waste,parings & scrap","Déchets, rognures et débris d'autres polyuréthanes"
3915900080,3915.90.00.80,3915.90.00.80 (1998-01/2011-12),199801,201112,KGM,KGM (1998-01/2011-12),199801,201112,"Cellulose or its chemical derivatives waste,parings & scrap","Déchets, rognures et débris de cellulose ou de ses dérivés chimiques"
3915900090,3915.90.00.90,3915.90.00.90 (1998-01/2011-12),199801,201112,KGM,KGM (1998-01/2011-12),199801,201112,"Plastics waste,parings & scrap, nes","Déchets, rognures et débris de matières plastiques, nda"
3915900090,3915.90.00.90,3915.90.00.90 (2012-01/2016-12),201201,201612,KGM,KGM (2012-01/2016-12),201201,201612,"Waste, parings and scrap, of other plastics, nes","Déchets, rognures et débris d'autres matières plastiques, nda"
3915900090,3915.90.00.90,3915.90.00.90 (2017-01/9999-12),201701,999912,KGM,KGM (2017-01/9999-12),201701,999912,"Waste, parings and scrap, of plastics, nes","Déchets, rognures et débris, de matières plastiques, nda"
3915901000,3915.90.10.00,3915.90.10.00 (1988-01/1997-12),198801,199712,KGM,KGM (1988-01/1997-12),198801,199712,"Polypropylene or other polyolefins waste,parings & scrap","Déchets, rognures et débris de polypropylène ou autres polyoléfines"
3915902000,3915.90.20.00,3915.90.20.00 (1988-01/1997-12),198801,199712,KGM,KGM (1988-01/1997-12),198801,199712,"Polyvinyl acetate or other polyvinyl monomers waste,parings & scrap","Déchets, rognures, etc de monomères d'acétate de polyvinyle ou autre polyvinyle"
3915903000,3915.90.30.00,3915.90.30.00 (1988-01/1997-12),198801,199712,KGM,KGM (1988-01/1997-12),198801,199712,"Polyacrylic waste,parings & scrap","Déchets, rognures et débris de polyacrylique"
3915904000,3915.90.40.00,3915.90.40.00 (1988-01/1997-12),198801,199712,KGM,KGM (1988-01/1997-12),198801,199712,"Polyacetals or other polyethers waste,parings & scrap","Déchets, rognures et débris de polyacétals ou autres polyéthers"
3915905000,3915.90.50.00,3915.90.50.00 (1988-01/1997-12),198801,199712,KGM,KGM (1988-01/1997-12),198801,199712,"Polycarbonates or other polyesters waste,parings & scrap","Déchets, rognures et débris de polycarbonates ou autres polyesters"
3915906000,3915.90.60.00,3915.90.60.00 (1988-01/1997-12),198801,199712,KGM,KGM (1988-01/1997-12),198801,199712,"Polyamides waste,parings & scrap","Déchets, rognures et débris de polyamides"
3915907100,3915.90.71.00,3915.90.71.00 (1988-01/1997-12),198801,199712,KGM,KGM (1988-01/1997-12),198801,199712,"Polyurethane in cellular form, waste,parings & scrap","Déchets, rognures et débris de polyuréthane sous forme alvéolaire"
3915907900,3915.90.79.00,3915.90.79.00 (1988-01/1997-12),198801,199712,KGM,KGM (1988-01/1997-12),198801,199712,"Other polyurethanes waste,parings & scrap","Déchets, rognures et débris d'autres polyuréthanes"
3915908000,3915.90.80.00,3915.90.80.00 (1988-01/1997-12),198801,199712,KGM,KGM (1988-01/1997-12),198801,199712,"Cellulose or its chemical derivatives waste,parings & scrap","Déchets, rognures et débris de cellulose ou de ses dérivés chimiques"
3915909000,3915.90.90.00,3915.90.90.00 (1988-01/1995-12),198801,199512,KGM,KGM (1988-01/1995-12),198801,199512,"Plastics waste,parings & scrap, nes","Déchets, rognures et débris de matières plastiques, nda"
3915909000,3915.90.90.00,3915.90.90.00 (1996-01/1997-12),199601,199712,KGM,KGM (1996-01/1997-12),199601,199712,"Plastics waste,parings & scrap, nes","Déchets, rognures et débris de matières plastiques, nda"
3916100000,3916.10.00.00,3916.10.00.00 (1988-01/9999-12),198801,999912,KGM,KGM (1988-01/9999-12),198801,999912,"Monofilaments >1mm,rods,sticks & profile shapes of polymers of ehtylene","Monofilaments > 1 mm, joncs, bâtons et profilés, en polymères de l'éthylène"
3916200000,3916.20.00.00,3916.20.00.00 (2012-01/9999-12),201201,999912,,N/A (2012-01/9999-12),201201,999912,"Monofilaments >1 mm,rods,profile shapes,w/n surf-wrkd, of poly of vinyl chloride","Monofilaments >1mm,joncs,profilés,m ouvr en surf, en polym du chlorure de vinyle"
3916200010,3916.20.00.10,3916.20.00.10 (1988-01/2011-12),198801,201112,,N/A (1988-01/2011-12),198801,201112,"Cove base, floor edging, of polymers of vinyl chloride","Plinthes, bordures de plancher, en polymères du chlorure de vinyle"
3916200020,3916.20.00.20,3916.20.00.20 (1988-01/1994-12),198801,199412,,N/A (1988-01/1994-12),198801,199412,"Siding, for house or building exterior, of polymers of vinyl chloride","Parements extérieurs pour maison ou immeuble, en polymères du chlorure de vinyle"
3916200090,3916.20.00.90,3916.20.00.90 (1988-01/1994-12),198801,199412,KGM,KGM (1988-01/1994-12),198801,199412,"Monofilaments >1mm,rods,sticks,profile shapes, nes,of polymers of vinyl chloride","Monofilaments > 1 mm, joncs, bâtons, profilés, nda, polym du chlorure de vinyle"
3916200090,3916.20.00.90,3916.20.00.90 (1995-01/2011-12),199501,201112,KGM,KGM (1995-01/2011-12),199501,201112,"Monofilaments >1mm,rods,sticks,profile shapes, nes,of polymers of vinyl chloride","Monofilaments > 1 mm, joncs, bâtons, profilés, nda, polym du chlorure de vinyle"
3916900000,3916.90.00.00,3916.90.00.00 (2012-01/9999-12),201201,999912,KGM,KGM (2012-01/9999-12),201201,999912,"Monofilament,cross-section dim >1mm,rods,sticks & profile shapes,of plastics,nes","Monofilaments,dim transv >1mm,joncs,bâtons & profilés,de matières plastiques,nda"
3916901100,3916.90.11.00,3916.90.11.00 (1988-01/1997-12),198801,199712,KGM,KGM (1988-01/1997-12),198801,199712,"Monofilaments >1mm,rods,sticks,profile shapes of vulc fibre(cellulose/derivs)","Monofilaments > 1 mm, joncs, bâtons, profilés, fib vulcanisée,dériv cellulose"
3916901110,3916.90.11.10,3916.90.11.10 (1998-01/2011-12),199801,201112,KGM,KGM (1998-01/2011-12),199801,201112,"Monofilaments >1mm,rods,sticks,profile shapes of vulc fibre(cellulose/derivs)","Monofilaments > 1 mm, joncs, bâtons, profilés, fib vulcanisée,dériv cellulose"
3916901120,3916.90.11.20,3916.90.11.20 (1998-01/2011-12),199801,201112,KGM,KGM (1998-01/2011-12),199801,201112,"Monofilament >1mm, rod, stick, profile sh of regenerated cellulose","Monofilament >1 mm, jonc, bâton, profilé,en cellulose regénérée"
3916901910,3916.90.19.10,3916.90.19.10 (1988-01/2011-12),198801,201112,KGM,KGM (1988-01/2011-12),198801,201112,"Monofilaments >1mm,rods,sticks,profile shapes of celluloid","Monofilaments > 1 mm, joncs, bâtons, profilés, en celluloïd"
3916901990,3916.90.19.90,3916.90.19.90 (1988-01/1997-12),198801,199712,KGM,KGM (1988-01/1997-12),198801,199712,"Monofilaments >1mm,rods,sticks,profile sh of cellulose or its chemical derivs","Monofilaments > 1 mm, joncs, bâtons, profilés, en cellulose ou ses dériv chim"
3916901990,3916.90.19.90,3916.90.19.90 (1998-01/2011-12),199801,201112,KGM,KGM (1998-01/2011-12),199801,201112,"Monofilaments >1mm,rods,sticks,profile sh of cellulose or its chem derivs, nes","Monofilaments > 1 mm, joncs, bâtons, profilés, en cellulose/ses dériv chim, nda"
3916909000,3916.90.90.00,3916.90.90.00 (1988-01/1989-12),198801,198912,KGM,KGM (1988-01/1989-12),198801,198912,"Monofilaments > 1mm, rods, sticks, profile shapes of plastics nes","Monofilaments > 1mm, joncs, b âtons, profilés, en matières plastiques nda"
3916909010,3916.90.90.10,3916.90.90.10 (1990-01/1997-12),199001,199712,KGM,KGM (1990-01/1997-12),199001,199712,"Monofilaments >1mm,rods,sticks,profile shapes of acrylic polymers","Monofilaments > 1 mm, joncs, bâtons, profilés, en polymères acryliques"
3916909020,3916.90.90.20,3916.90.90.20 (1996-01/1997-12),199601,199712,KGM,KGM (1996-01/1997-12),199601,199712,"Polyurethane monofilaments >1mm,rods,sticks and profile shapes","Monofilaments en polyuréthannes, >1mm, joncs, bâtons, profilés"
3916909091,3916.90.90.91,3916.90.90.91 (1990-01/1997-12),199001,199712,MTR,MTR (1990-01/1997-12),199001,199712,"Racquet strings, of plastics","Cordes pour raquettes, en matières plastiques"
3916909099,3916.90.90.99,3916.90.90.99 (1990-01/1995-12),199001,199512,KGM,KGM (1990-01/1995-12),199001,199512,"Monofilaments >1mm,rods,sticks, profile shapes of plastics nes","Monofilaments > 1 mm, joncs, bâtons, profilés, en matières plastiques nda"
3916909099,3916.90.90.99,3916.90.90.99 (1996-01/1997-12),199601,199712,KGM,KGM (1996-01/1997-12),199601,199712,"Monofilaments >1mm,rods,sticks, profile shapes of plastics nes","Monofilaments > 1 mm, joncs, bâtons, profilés, en matières plastiques nda"
3916909110,3916.90.91.10,3916.90.91.10 (1998-01/2011-12),199801,201112,KGM,KGM (1998-01/2011-12),199801,201112,"Monofilament acrylic polymer,>1mm,empl in re-spooling & pkg fishing lines,etc","Monofilament polymère acrylique,>1mm,util au rebobinage & emb ligne à pêche,nda"
3916909190,3916.90.91.90,3916.90.91.90 (1998-01/2001-07),199801,200107,KGM,KGM (1998-01/2001-07),199801,200107,"Monofilament of plastics, >1mm,empl in re-spooling & packaging fishing lines etc","Monofilament en mati plastique, >1mm,util au rebobinage & emb ligne pêche,etc"
3916909190,3916.90.91.90,3916.90.91.90 (2001-08/2011-12),200108,201112,KGM,KGM (2001-08/2011-12),200108,201112,"Monofilament of plastics, >1mm,empl in re-spooling & packaging fishing lines etc","Monofilament en mati plastique, >1mm,util au rebobinage & emb ligne pêche,etc"
3916909910,3916.90.99.10,3916.90.99.10 (1998-01/2011-12),199801,201112,KGM,KGM (1998-01/2011-12),199801,201112,"Polyurethane monofilaments >1mm,rods,sticks and profile shapes","Monofilaments en polyuréthannes, >1mm, joncs, bâtons, profilés"
3916909991,3916.90.99.91,3916.90.99.91 (1998-01/2011-12),199801,201112,MTR,MTR (1998-01/2011-12),199801,201112,"Racquet strings, of plastics","Cordes pour raquettes, en matières plastiques"
3916909998,3916.90.99.98,3916.90.99.98 (1998-01/2011-12),199801,201112,KGM,KGM (1998-01/2011-12),199801,201112,"Monofilaments >1mm,rods,sticks,profile shapes of acrylic polymers, nes","Monofilaments > 1 mm, joncs, bâtons, profilés, en polymères acryliques, nda"
3916909999,3916.90.99.99,3916.90.99.99 (1998-01/2001-07),199801,200107,KGM,KGM (1998-01/2001-07),199801,200107,"Monofilaments >1mm,rods,sticks, profile shapes of plastics nes","Monofilaments > 1 mm, joncs, bâtons, profilés, en matières plastiques nda"
