9506912020,9506.91.20.20,9506.91.20.20 (1988-11/1989-06),198811,198906,,N/A (1988-11/1989-06),198811,198906,Hydraulic resistance cylinders used in physical exercise machines,Cylindres hydrauliques de résistance pour exercice physique
9506912090,9506.91.20.90,9506.91.20.90 (1989-07/1997-12),198907,199712,,N/A (1989-07/1997-12),198907,199712,Parts of cycling exercise apparatus equipped with electronic monitors,Parties pour cycles d'exerciseurs munis d'indicateurs électroniques de contrôles
9506919010,9506.91.90.10,9506.91.90.10 (1988-01/1988-10),198801,198810,NMB,NMB (1988-01/1988-10),198801,198810,"Cycling exercise apparatus, not equipped with electronic monitors",Cycles d'exerciseurs sans moniteurs électroniques
9506919010,9506.91.90.10,9506.91.90.10 (1988-11/1997-12),198811,199712,NMB,NMB (1988-11/1997-12),198811,199712,"Cycling exercise apparatus, not equipped with electronic monitors",Cycles d'exerciseurs sans moniteurs électroniques
9506919010,9506.91.90.10,9506.91.90.10 (1998-07/2011-12),199807,201112,NMB,NMB (1998-07/2011-12),199807,201112,Rowing machines,Machines à ramer d'exercice
9506919011,9506.91.90.11,9506.91.90.11 (1998-01/1998-06),199801,199806,NMB,NMB (1998-01/1998-06),199801,199806,"Cycling exercise apparatus, nes, equipped with electronic monitors","Cycles d'exerciseurs, nda, munis d'indicateurs électroniques de contrôle"
9506919019,9506.91.90.19,9506.91.90.19 (1998-01/1998-06),199801,199806,NMB,NMB (1998-01/1998-06),199801,199806,"Cycling exercise apparatus, nes, not equipped with electronic monitors","Cycles d'exerciseurs, nda, sans moniteurs électroniques"
9506919020,9506.91.90.20,9506.91.90.20 (1988-01/2018-12),198801,201812,NMB,NMB (1988-01/2018-12),198801,201812,Trampolines,Trampolines
9506919030,9506.91.90.30,9506.91.90.30 (1988-01/1998-06),198801,199806,NMB,NMB (1988-01/1998-06),198801,199806,Rowing machines,Machines à ramer d'exercice
9506919090,9506.91.90.90,9506.91.90.90 (1988-01/1997-12),198801,199712,,N/A (1988-01/1997-12),198801,199712,"Gymnasium or athletic articles and equipment, nes","Articles et matériel de gymnastique ou d'athlétisme, nda"
9506919090,9506.91.90.90,9506.91.90.90 (1998-01/1998-08),199801,199808,,N/A (1998-01/1998-08),199801,199808,"Gymnasium or athletic articles and equipment, nes","Articles et matériel de gymnastique ou d'athlétisme, nda"
9506919090,9506.91.90.90,9506.91.90.90 (1998-09/2011-12),199809,201112,,N/A (1998-09/2011-12),199809,201112,"Gymnasium or athletic articles and equipment, nes","Articles et matériel de gymnastique ou d'athlétisme, nda"
9506919090,9506.91.90.90,9506.91.90.90 (2012-01/2018-12),201201,201812,,N/A (2012-01/2018-12),201201,201812,"Articles & equipment for general physical exercise, gymnastics or athletics,nes","Articles et matériel pr culture physique,gymnastique ou l'athlétisme, nda"
9506990011,9506.99.00.11,9506.99.00.11 (2019-01/9999-12),201901,999912,NMB,NMB (2019-01/9999-12),201901,999912,"Hockey sticks, for ice hockey","Bâtons de hockey, pour hockey sur glace"
9506990019,9506.99.00.19,9506.99.00.19 (2019-01/9999-12),201901,999912,,N/A (2019-01/9999-12),201901,999912,"Equipment for ice or field-hockey, nes","Articles et matériel de hockey sur glace ou sur gazon, nda"
9506990020,9506.99.00.20,9506.99.00.20 (2019-01/9999-12),201901,999912,,N/A (2019-01/9999-12),201901,999912,Archery equipment,Articles pour le tir à l'arbalète et à l'arc
9506990030,9506.99.00.30,9506.99.00.30 (2019-01/9999-12),201901,999912,NMB,NMB (2019-01/9999-12),201901,999912,"Swimming or wading (paddling) pools, above ground","Piscines ou pataugeoires, hors terre"
9506990040,9506.99.00.40,9506.99.00.40 (2019-01/9999-12),201901,999912,,N/A (2019-01/9999-12),201901,999912,"Parts and accessories for swimming or wading, paddling, pools",Parties et accessoires pour piscines ou pataugeoires
9506990050,9506.99.00.50,9506.99.00.50 (2019-01/9999-12),201901,999912,,N/A (2019-01/9999-12),201901,999912,"Playground equipment, nes","Équipment de terrain de jeu, nda"
9506990060,9506.99.00.60,9506.99.00.60 (2019-01/9999-12),201901,999912,,N/A (2019-01/9999-12),201901,999912,Parts and accessories for playground equipment,Parties et accessoires pour équipment de terrain de jeu
9506990070,9506.99.00.70,9506.99.00.70 (2019-01/9999-12),201901,999912,,N/A (2019-01/9999-12),201901,999912,"Snowshoes; sleds, bobsleds tobaggans and the like","Raquette à neige; traîneaux, luges, bobsleighs, toboggans et articles similaires"
9506990090,9506.99.00.90,9506.99.00.90 (2019-01/9999-12),201901,999912,,N/A (2019-01/9999-12),201901,999912,"Articles and equipment for other sports or outdoor games, nes","Articles et matériel pour d'autres sports ou jeux de plein air, nda"
9506991000,9506.99.10.00,9506.99.10.00 (1988-01/1997-12),198801,199712,,N/A (1988-01/1997-12),198801,199712,"Leg pads and bats, for cricket",Jambières et battes pour le cricket
9506991000,9506.99.10.00,9506.99.10.00 (2012-01/2018-12),201201,201812,,N/A (2012-01/2018-12),201201,201812,Badminton birds (shuttle-cocks); baseball bats of aluminium; etc,Volants de badminton; bâton de baseaball en aluminium; etc
9506991010,9506.99.10.10,9506.99.10.10 (1998-01/2011-12),199801,201112,,N/A (1998-01/2011-12),199801,201112,"Badminton birds, shuttle-cocks",Volants de badminton
9506991020,9506.99.10.20,9506.99.10.20 (1998-01/2011-12),199801,201112,NMB,NMB (1998-01/2011-12),199801,201112,"Bats, aluminum, for baseball","Bâtons de base-ball, en aluminium"
9506991030,9506.99.10.30,9506.99.10.30 (1998-01/2011-12),199801,201112,,N/A (1998-01/2011-12),199801,201112,"Face masks and shoulder pads, for football",Masques et épaulières pour le football
9506991040,9506.99.10.40,9506.99.10.40 (1998-01/2011-12),199801,201112,,N/A (1998-01/2011-12),199801,201112,Articles and equipment for climbing or mountaineering,Articles et équipement pour l'escalade ou l'alpinisme
9506992000,9506.99.20.00,9506.99.20.00 (1988-01/1997-12),198801,199712,,N/A (1988-01/1997-12),198801,199712,"Face masks and shoulder pads, for football",Masques et épaulières pour le football
9506992010,9506.99.20.10,9506.99.20.10 (1998-01/2011-12),199801,201112,,N/A (1998-01/2011-12),199801,201112,Clay pigeons for trapshooting; curling stones,Pigeons d'argile pour le tir aux pigeons; pierres pour le curling
9506992021,9506.99.20.21,9506.99.20.21 (1998-01/2011-12),199801,201112,DZN,DZN (1998-01/2011-12),199801,201112,"Hockey sticks, for field hockey","Bâtons de hockey, pour hockey sur gazon"
9506992022,9506.99.20.22,9506.99.20.22 (1998-01/2011-12),199801,201112,DZN,DZN (1998-01/2011-12),199801,201112,"Hockey sticks, for ice hockey","Bâtons de hockey, pour hockey sur glace"
9506992023,9506.99.20.23,9506.99.20.23 (1998-01/2011-12),199801,201112,,N/A (1998-01/2011-12),199801,201112,Parts of ice hockey sticks,Parties pour bâtons de hockey sur glace
9506992030,9506.99.20.30,9506.99.20.30 (2012-01/2018-12),201201,201812,DZN,DZN (2012-01/2018-12),201201,201812,"Hockey sticks, for ice hockey","Bâtons de hockey, pour hockey sur glace"
9506992040,9506.99.20.40,9506.99.20.40 (2012-01/2016-12),201201,201612,,N/A (2012-01/2016-12),201201,201612,Parts of ice hockey sticks,Parties pour bâtons de hockey sur glace
9506992090,9506.99.20.90,9506.99.20.90 (2012-01/2016-12),201201,201612,,N/A (2012-01/2016-12),201201,201612,"Clay pigeons for trapshooting;curling stones;o hockey sticks,o/t ice hockey,nes","Pigeon d'argile pr tir au pigeon;pierre pr le curling;bâton hockey,a/q glace,nda"
9506992090,9506.99.20.90,9506.99.20.90 (2017-01/2018-12),201701,201812,,N/A (2017-01/2018-12),201701,201812,Clay pigeons for trapshooting; curling stones,Pigeons d'argile pour le tir aux pigeons; pierres pour le curling
9506993000,9506.99.30.00,9506.99.30.00 (1988-01/1995-06),198801,199506,,N/A (1988-01/1995-06),198801,199506,Curling stones; clay pigeons of a kind used in trapshooting,Palets(pierres)de curling;disques(pigeons)d'argile pour ball-trap(tir sportif)
9506993000,9506.99.30.00,9506.99.30.00 (1995-07/1997-12),199507,199712,,N/A (1995-07/1997-12),199507,199712,Curling stones; clay pigeons of a kind used in trapshooting,Palets(pierres)de curling;disques(pigeons)d'argile pour ball-trap(tir sportif)
9506993100,9506.99.31.00,9506.99.31.00 (2012-01/2018-12),201201,201812,,N/A (2012-01/2018-12),201201,201812,"Automated batting cage;clay target thrower mach;throwing/pitching mach, etc","Cage automatisé pr batteur;lance-pigeon d'argile;lanceur méc pr balle,etc"
9506993110,9506.99.31.10,9506.99.31.10 (1998-01/2011-12),199801,201112,,N/A (1998-01/2011-12),199801,201112,"Automated batting cages & throwing/pitching mach for baseballs/softball, pwr-op","Cage automatisée pr batteurs,lanceur méc pr balle de base-ball/balle-molle, mot"
9506993120,9506.99.31.20,9506.99.31.20 (1998-01/2011-12),199801,201112,,N/A (1998-01/2011-12),199801,201112,Clay target thrower machines,Lance-pigeons d'argile
9506993900,9506.99.39.00,9506.99.39.00 (1998-01/2018-12),199801,201812,,N/A (1998-01/2018-12),199801,201812,"Power-operated equip used in the development of athletic skills, nes","Matériel motorisé pr le développement des capacités athlétiques, nda"
9506994000,9506.99.40.00,9506.99.40.00 (1998-01/2018-12),199801,201812,,N/A (1998-01/2018-12),199801,201812,"Leg pads and bats, for cricket",Jambières et battes pour le cricket
9506994100,9506.99.41.00,9506.99.41.00 (1988-01/1997-12),198801,199712,DZN,DZN (1988-01/1997-12),198801,199712,"Hockey sticks, for field hockey","Bâtons de hockey, pour hockey sur gazon"
9506994900,9506.99.49.00,9506.99.49.00 (1988-01/1988-12),198801,198812,DZN,DZN (1988-01/1988-12),198801,198812,"Hockey sticks, for ice hockey","Bâtons de hockey, pour hockey sur glace"
9506994910,9506.99.49.10,9506.99.49.10 (1989-01/1997-12),198901,199712,DZN,DZN (1989-01/1997-12),198901,199712,"Hockey sticks, for ice hockey","Bâtons de hockey, pour hockey sur glace"
9506994920,9506.99.49.20,9506.99.49.20 (1989-01/1997-12),198901,199712,,N/A (1989-01/1997-12),198901,199712,Parts of ice hockey sticks,Parties pour bâtons de hockey sur glace
9506995000,9506.99.50.00,9506.99.50.00 (1988-01/1997-12),198801,199712,,N/A (1988-01/1997-12),198801,199712,"Axes, ice, designed for climbing and mountaineering","Piolets (à glace), pour l'escalade et l'alpinisme"
9506995010,9506.99.50.10,9506.99.50.10 (1998-01/2011-12),199801,201112,,N/A (1998-01/2011-12),199801,201112,"Shin-guards,shoulder/elbow pads,waist,thigh & hip protective equip for baseball","Protège-tibias,coudières,épaulières,plastrons,jambières,etc,pour le base-ball"
9506995020,9506.99.50.20,9506.99.50.20 (1998-01/2018-12),199801,201812,,N/A (1998-01/2018-12),199801,201812,"Shin-guards,shoulder/elbow pads,waist thigh & hip protective equip, for hockey","Protège-tibias,coudières,épaulières,plastrons,jambières,etc,pour le hockey"
9506995090,9506.99.50.90,9506.99.50.90 (1998-01/2011-12),199801,201112,,N/A (1998-01/2011-12),199801,201112,"Shin-guards & shoulder/elbow pads, o/t football,waist,thigh & hip protectors,nes","Protège-tibia, coudière, épaulière, a/q football plastron,jambière,etc,sport,nda"
9506995090,9506.99.50.90,9506.99.50.90 (2012-01/2018-12),201201,201812,,N/A (2012-01/2018-12),201201,201812,"Shin-guard&shoulder/elbow pad,o/t football;waist,thigh&hip protective equip,nes","Protège-tibia&coudière/épaulière,a/q football;protec taille/cuisse/hanche,nda"
9506996010,9506.99.60.10,9506.99.60.10 (1988-01/1997-12),198801,199712,,N/A (1988-01/1997-12),198801,199712,Power-operated equip used in the development of skills for baseball or softball,Matériel motorisé d'entraînement pour le base-ball ou la balle-molle
9506996090,9506.99.60.90,9506.99.60.90 (1988-01/1997-12),198801,199712,,N/A (1988-01/1997-12),198801,199712,Power-operated equip used in the development of skills o/t baseball or softball,Matériel motorisé d'entraînement a/q au base-ball ou à la balle-molle
9506997000,9506.99.70.00,9506.99.70.00 (1988-01/1989-12),198801,198912,,N/A (1988-01/1989-12),198801,198912,"Shin-guards,shoulder/elbow pads o/t football;waist,thigh & hip proctective equip","Protège-tibia, coudières, épaulières a/q football; plastrons, jambières, etc"
9506997010,9506.99.70.10,9506.99.70.10 (1990-01/1997-12),199001,199712,,N/A (1990-01/1997-12),199001,199712,"Shin-guards,shoulder/elbow pads,waist,thigh & hip protective equip for baseball","Protège-tibias,coudières,épaulières,plastrons,jambières,etc,pour le base-ball"
9506997020,9506.99.70.20,9506.99.70.20 (1990-01/1997-12),199001,199712,,N/A (1990-01/1997-12),199001,199712,"Shin-guards,shoulder/elbow pads,waist thigh & hip protective equip, for hockey","Protège-tibias,coudières,épaulières,plastrons,jambières,etc,pour le hockey"
9506997090,9506.99.70.90,9506.99.70.90 (1990-01/1997-12),199001,199712,,N/A (1990-01/1997-12),199001,199712,"Shin-guards & shoulder/elbow pads,o/t football,waist,thigh & hip protectors,nes","Protège-tibias,coudières,épaulières,plastrons,jambières,etc,pour les sports nda"
9506998100,9506.99.81.00,9506.99.81.00 (1988-01/1997-12),198801,199712,,N/A (1988-01/1997-12),198801,199712,"Archery equipment, of wood","Équipement pour le tir à l'arc ou à l'arbalète, en bois"
9506998900,9506.99.89.00,9506.99.89.00 (1988-01/1997-12),198801,199712,,N/A (1988-01/1997-12),198801,199712,"Archery equipment, o/t of wood","Équipement pour le tir à l'arc ou à l'arbalète, a/q en bois"
9506999010,9506.99.90.10,9506.99.90.10 (2017-01/2018-12),201701,201812,,N/A (2017-01/2018-12),201701,201812,Archery equipment,Articles pour le tir à l'arbalète et à l'arc
9506999011,9506.99.90.11,9506.99.90.11 (1988-01/1992-02),198801,199202,NMB,NMB (1988-01/1992-02),198801,199202,"Bats, for baseball or softball, finished","Bâtons de base-ball ou de balle-molle, finies"
9506999011,9506.99.90.11,9506.99.90.11 (1998-01/2016-12),199801,201612,,N/A (1998-01/2016-12),199801,201612,"Archery equipment, of wood","Équipement pour le tir à l'arc ou à l'arbalète, en bois"
9506999012,9506.99.90.12,9506.99.90.12 (1988-01/1992-02),198801,199202,,N/A (1988-01/1992-02),198801,199202,"Bats, for baseball or softball, unfinished","Bâtons de base-ball ou de balle-molle, non finies"
9506999019,9506.99.90.19,9506.99.90.19 (1998-01/2016-12),199801,201612,,N/A (1998-01/2016-12),199801,201612,"Archery equipment, o/t of wood","Équipement pour le tir à l'arc ou à l'arbalète, a/q en bois"
9506999020,9506.99.90.20,9506.99.90.20 (1999-01/2011-12),199901,201112,NMB,NMB (1999-01/2011-12),199901,201112,Bats for baseball or softball,Bâtons de base-ball ou de balle-molle
9506999020,9506.99.90.20,9506.99.90.20 (2017-01/2018-12),201701,201812,NMB,NMB (2017-01/2018-12),201701,201812,"Swimming or wading (paddling) pools, above ground","Piscines ou pataugeoires, hors terre"
9506999021,9506.99.90.21,9506.99.90.21 (1988-01/1992-02),198801,199202,,N/A (1988-01/1992-02),198801,199202,"Nets, badminton",Filets de badminton
9506999021,9506.99.90.21,9506.99.90.21 (1998-01/1998-12),199801,199812,NMB,NMB (1998-01/1998-12),199801,199812,"Bats for baseball, excl aluminum, or softball, finished","Bâtons de base-ball, a/q aluminium, ou de balle-molle, finis"
9506999022,9506.99.90.22,9506.99.90.22 (1988-01/1992-02),198801,199202,,N/A (1988-01/1992-02),198801,199202,"Nets, tennis",Filets de tennis
9506999022,9506.99.90.22,9506.99.90.22 (1998-01/1998-12),199801,199812,,N/A (1998-01/1998-12),199801,199812,"Bats for baseball, excl aluminum, or softball, unfinished","Bâtons de base-ball, a/q aluminium, ou de balle-molle, non finis"
9506999030,9506.99.90.30,9506.99.90.30 (1988-01/1992-02),198801,199202,,N/A (1988-01/1992-02),198801,199202,"Badminton birds, shuttle cocks",Volants de badminton
9506999031,9506.99.90.31,9506.99.90.31 (1998-01/2011-12),199801,201112,,N/A (1998-01/2011-12),199801,201112,"Nets, badminton",Filets de badminton
9506999032,9506.99.90.32,9506.99.90.32 (1998-01/2011-12),199801,201112,,N/A (1998-01/2011-12),199801,201112,"Nets, tennis",Filets de tennis
9506999041,9506.99.90.41,9506.99.90.41 (1988-01/1992-02),198801,199202,NMB,NMB (1988-01/1992-02),198801,199202,"Swimming pools, above ground",Piscines hors-terre
9506999041,9506.99.90.41,9506.99.90.41 (1998-01/2016-12),199801,201612,NMB,NMB (1998-01/2016-12),199801,201612,"Swimming pools, above ground",Piscines hors-terre
9506999042,9506.99.90.42,9506.99.90.42 (1988-01/1992-02),198801,199202,NMB,NMB (1988-01/1992-02),198801,199202,"Wadding (paddling) pools, above ground",Pataugeoires hors-terre
9506999042,9506.99.90.42,9506.99.90.42 (1998-01/2016-12),199801,201612,NMB,NMB (1998-01/2016-12),199801,201612,"Wadding, paddling, pools, above ground",Pataugeoires hors-terre
9506999050,9506.99.90.50,9506.99.90.50 (1988-01/1992-02),198801,199202,,N/A (1988-01/1992-02),198801,199202,"Swimming pools, in ground",Piscines creusées
9506999050,9506.99.90.50,9506.99.90.50 (1998-01/2011-12),199801,201112,,N/A (1998-01/2011-12),199801,201112,"Swimming pools, in ground",Piscines creusées
9506999060,9506.99.90.60,9506.99.90.60 (1988-01/1992-02),198801,199202,NMB,NMB (1988-01/1992-02),198801,199202,Hockey pucks,Palets (pucks) de hockey
9506999060,9506.99.90.60,9506.99.90.60 (1998-01/2011-12),199801,201112,NMB,NMB (1998-01/2011-12),199801,201112,Hockey pucks,Palets (pucks) de hockey
9506999070,9506.99.90.70,9506.99.90.70 (1988-01/1992-02),198801,199202,,N/A (1988-01/1992-02),198801,199202,Croquet sets,Jeux de croquet
9506999070,9506.99.90.70,9506.99.90.70 (1998-01/2011-12),199801,201112,,N/A (1998-01/2011-12),199801,201112,Croquet sets,Jeux de croquet
9506999081,9506.99.90.81,9506.99.90.81 (1988-01/1992-02),198801,199202,,N/A (1988-01/1992-02),198801,199202,"Equipment of a kind used in playgrounds, nes","Articles et matériel pour terrains de jeux, nda"
9506999081,9506.99.90.81,9506.99.90.81 (1998-01/2011-12),199801,201112,,N/A (1998-01/2011-12),199801,201112,"Equipment of a kind used in playgrounds, nes","Articles et matériel pour terrains de jeux, nda"
9506999081,9506.99.90.81,9506.99.90.81 (2012-01/2018-12),201201,201812,,N/A (2012-01/2018-12),201201,201812,"Equipment of a kind used in playgrounds, nes","Articles et matériel pour terrains de jeux, nda"
9506999082,9506.99.90.82,9506.99.90.82 (1990-01/1992-02),199001,199202,,N/A (1990-01/1992-02),199001,199202,"Equipment for baseball, nes","Articles et matériel de base-ball, nda"
9506999082,9506.99.90.82,9506.99.90.82 (1998-01/2011-12),199801,201112,,N/A (1998-01/2011-12),199801,201112,"Equipment for baseball, nes","Articles et matériel de base-ball, nda"
9506999083,9506.99.90.83,9506.99.90.83 (1990-01/1992-02),199001,199202,,N/A (1990-01/1992-02),199001,199202,"Equipment for ice or field-hockey, nes","Articles et matériel de hockey sur glace ou sur gazon, nda"
9506999083,9506.99.90.83,9506.99.90.83 (1998-01/2011-12),199801,201112,,N/A (1998-01/2011-12),199801,201112,"Equipment for ice or field-hockey, nes","Articles et matériel de hockey sur glace ou sur gazon, nda"
9506999083,9506.99.90.83,9506.99.90.83 (2012-01/2018-12),201201,201812,,N/A (2012-01/2018-12),201201,201812,"Equipment for ice or field-hockey, nes","Articles et matériel de hockey sur glace ou sur gazon, nda"
9506999084,9506.99.90.84,9506.99.90.84 (1990-01/1992-02),199001,199202,,N/A (1990-01/1992-02),199001,199202,"Equipment for lawn tennis, nes","Articles et matériel de tennis, nda"
9506999084,9506.99.90.84,9506.99.90.84 (1998-01/2011-12),199801,201112,,N/A (1998-01/2011-12),199801,201112,"Equipment for lawn tennis, nes","Articles et matériel de tennis, nda"
9506999085,9506.99.90.85,9506.99.90.85 (1990-01/1992-02),199001,199202,,N/A (1990-01/1992-02),199001,199202,"Snowshoes; sleds, bobsleds, toboggans and the like","Raquettes à neige; traîneaux, bobsleighs, toboggans et engins similaires"
9506999085,9506.99.90.85,9506.99.90.85 (1998-01/2011-12),199801,201112,,N/A (1998-01/2011-12),199801,201112,"Snowshoes, sleds, bobsleds toboggans and the like","Raquette à neige, traîneaux, bobsleighs, toboggans et engins similaires"
9506999085,9506.99.90.85,9506.99.90.85 (2012-01/2018-12),201201,201812,,N/A (2012-01/2018-12),201201,201812,"Snowshoes; sleds, bobsleds tobaggans and the like","Raquette à neige; traîneaux, luges, bobsleighs, toboggans et articles similaires"
9506999089,9506.99.90.89,9506.99.90.89 (1988-01/1989-12),198801,198912,,N/A (1988-01/1989-12),198801,198912,"Articles and equip for gymnastics, athletics & other sports & games, nes","Articles et matériel de gymnastique,d'athlétisme ou d'autres sports ou jeux,nda"
9506999089,9506.99.90.89,9506.99.90.89 (1990-01/1992-02),199001,199202,,N/A (1990-01/1992-02),199001,199202,"Articles and equip for gymnastics, athletics & other sports & games, nes","Articles et matériel de gymnastique,d'athlétisme ou d'autres sports ou jeux,nda"
9506999089,9506.99.90.89,9506.99.90.89 (1998-01/2011-12),199801,201112,,N/A (1998-01/2011-12),199801,201112,"Articles and equipment for gymnastics, athletics and other sports and games, nes","Articles et matériel de gymnastique d'athlétisme ou d'autres sports ou jeux, nda"
9506999089,9506.99.90.89,9506.99.90.89 (2012-01/2018-12),201201,201812,,N/A (2012-01/2018-12),201201,201812,"Articles and equipment for other sports or outdoor games, nes","Articles et matériel pour d'autres sports ou jeux de plein air, nda"
9506999091,9506.99.90.91,9506.99.90.91 (1988-01/1992-02),198801,199202,,N/A (1988-01/1992-02),198801,199202,Parts and accessories for swimming or wading (paddling) pools,Parties et accessoires pour piscines ou pataugeoires
9506999091,9506.99.90.91,9506.99.90.91 (1998-01/2018-12),199801,201812,,N/A (1998-01/2018-12),199801,201812,"Parts and accessories for swimming or wading, paddling, pools",Parties et accessoires pour piscines ou pataugeoires
9506999092,9506.99.90.92,9506.99.90.92 (1988-01/1992-02),198801,199202,,N/A (1988-01/1992-02),198801,199202,Parts and accessories for playground equipment,Parties et accessoire pour matériel de terrains de jeux
9506999092,9506.99.90.92,9506.99.90.92 (1998-01/2018-12),199801,201812,,N/A (1998-01/2018-12),199801,201812,Parts and accessories for playground equipment,Parties et accessoires pour matériel de terrains de jeux
9506999093,9506.99.90.93,9506.99.90.93 (1990-01/1992-02),199001,199202,,N/A (1990-01/1992-02),199001,199202,Parts and accessories for baseball,Parties et accessoires pour le base-ball
9506999093,9506.99.90.93,9506.99.90.93 (1998-01/2011-12),199801,201112,,N/A (1998-01/2011-12),199801,201112,Parts et accessories for baseball,Parties et accessoires pour le base-ball
9506999094,9506.99.90.94,9506.99.90.94 (1990-01/1992-02),199001,199202,,N/A (1990-01/1992-02),199001,199202,Parts and accessories for ice or field-hockey,Parties et accessoires pour le hockey sur gazon ou sur glace
9506999094,9506.99.90.94,9506.99.90.94 (1998-01/2011-12),199801,201112,,N/A (1998-01/2011-12),199801,201112,Parts and accessories for ice or field-hockey,Parties et accessoires pour le hockey sur gazon ou sur glace
9506999095,9506.99.90.95,9506.99.90.95 (1990-01/1992-02),199001,199202,,N/A (1990-01/1992-02),199001,199202,Parts and accessories for lawn tennis,Parties et accessoires pour le tennis
9506999095,9506.99.90.95,9506.99.90.95 (1998-01/2011-12),199801,201112,,N/A (1998-01/2011-12),199801,201112,Parts and accessories for lawn tennis,Parties et accessoires pour le tennis
9506999096,9506.99.90.96,9506.99.90.96 (1990-01/1992-02),199001,199202,,N/A (1990-01/1992-02),199001,199202,"Parts and accessories for snowshoes, sleds, bobsleds, toboggans, and the like","Part et acces pour raquettes à neige,luges,bobsleighs,toboggans et engins sim"
9506999096,9506.99.90.96,9506.99.90.96 (1998-01/2011-12),199801,201112,,N/A (1998-01/2011-12),199801,201112,"Parts and accessories for snowshoes, sleds, bobsleds, toboggans and the like","Pts et access pour raquettes à neige,luges,bobsleighs,toboggans et engins sim"
9506999099,9506.99.90.99,9506.99.90.99 (1988-01/1989-12),198801,198912,,N/A (1988-01/1989-12),198801,198912,"Parts and access for art & equip for gymnastics,athletics/other sports, nes","Parties et acces pour matériel de gymnastique,d'athlétisme ou autres sports,nda"
9506999099,9506.99.90.99,9506.99.90.99 (1990-01/1992-02),199001,199202,,N/A (1990-01/1992-02),199001,199202,"Parts and access for art & equip for gymnastics,athletics/other sports, nes","Parties et acces pour matériel de gymnastique,d'athlétisme ou autres sports,nda"
9506999099,9506.99.90.99,9506.99.90.99 (1998-01/2011-12),199801,201112,,N/A (1998-01/2011-12),199801,201112,"Parts and access for art and equip for gymnastics, athletics/other sports, nes","Pts et acces pour matériel de gymnastique, d'athlétisme ou autres sports, nda"
9506999099,9506.99.90.99,9506.99.90.99 (2012-01/2018-12),201201,201812,,N/A (2012-01/2018-12),201201,201812,"Parts and access for other sports or outdoor games, nes","Parties et acces pour d'autres sports ou jeux de plein air, nda"
9506999100,9506.99.91.00,9506.99.91.00 (1992-03/1997-12),199203,199712,NMB,NMB (1992-03/1997-12),199203,199712,"Bats, aluminum, for baseball","Bâtons de base-ball, en aluminium"
9506999200,9506.99.92.00,9506.99.92.00 (1995-07/1997-12),199507,199712,,N/A (1995-07/1997-12),199507,199712,Badminton birds (shuttle-cocks),Volants de badminton
9506999911,9506.99.99.11,9506.99.99.11 (1992-03/1997-12),199203,199712,NMB,NMB (1992-03/1997-12),199203,199712,"Bats for baseball, excl aluminum, or softball, finished","Bâtons de base-ball, a/q aluminium, ou de balle-molle finies"
9506999912,9506.99.99.12,9506.99.99.12 (1992-03/1997-12),199203,199712,,N/A (1992-03/1997-12),199203,199712,"Bats for baseball, excl aluminum, or softball, unfinished","Bâtons de base-ball, a/q aluminium, ou de balle-molle non finies"
9506999921,9506.99.99.21,9506.99.99.21 (1992-03/1997-12),199203,199712,,N/A (1992-03/1997-12),199203,199712,"Nets, badminton",Filets de badminton
9506999922,9506.99.99.22,9506.99.99.22 (1992-03/1997-12),199203,199712,,N/A (1992-03/1997-12),199203,199712,"Nets, tennis",Filets de tennis
